"Authorization solution for full stack FHIR HAPI access","Z. R. Jánki; Z. Szabó; V. Bilicki; M. Fidrich","Department of Software Engineering, University of Szeged, Szeged, Hungary; Department of Software Engineering, University of Szeged, Szeged, Hungary; Department of Software Engineering, University of Szeged, Szeged, Hungary; Department of Software Engineering, University of Szeged, Szeged, Hungary",2017 IEEE 30th Neumann Colloquium (NC),"18 Jan 2018","2017","","","000121","000124","The Health Level Seven's (HL7) Fast Healthcare Interoperability Resources (FHIR) standard enables the standardized access to the health related data stored in different Electronic Health Record (EHR) backends. A popular open source implementation of FHIR is the Java-based HAPI. It provides generic FHIR-compatible Representational State Transfer (REST) interfaces for data access. One weak point of this solution is the lack of client side support. It supports only Java-based client environments. This is useful in the case of Android-based native client, but for the JavaScript or TypeScript-based full stack environments a JavaScript-based environment is needed. Here, we present our solution which integrates HAPI into a JavaScript-based full stack environment. Another novelty of our solution is that it extends the FHIR's access control model so that it has the best aspects of Role-Based Access Control (RBAC) and Attribute-Based Access Control (ABAC) access control approaches.","","978-1-5386-4636-6","10.1109/NC.2017.8263266","","https://ieeexplore.ieee.org/stamp/stamp.jsp?arnumber=8263266","authorization;full stack;FHIR","Authorization","","3","","6","IEEE","18 Jan 2018","","","IEEE","IEEE Conferences"
"Enabling AI-Augmented Clinical Workflows by Accessing Patient Data in Real-Time with FHIR","V. J. Major; W. Wang; Y. Aphinyanaphongs","Dept. of Population Health, NYU Grossman School of Medicine, New York, NY, USA; Dept. of Population Health, NYU Grossman School of Medicine, New York, NY, USA; Dept. of Population Health, NYU Grossman School of Medicine, New York, NY, USA",2023 IEEE 11th International Conference on Healthcare Informatics (ICHI),"11 Dec 2023","2023","","","531","533","AI systems developed for clinical applications often need to operate in real-time to achieve their intended impacts. However, sourcing data inputs in real-time remains a challenge. FHIR involves a set of interoperable resources that enable reading of patient data directly from the EHR and can be used to retrieve data inputs to feed into AI models. This tutorial will introduce FHIR and walk-through how to configure a FHIR app in Epic and develop python code to automatically read patient data and forward it to downstream AI systems.","2575-2634","979-8-3503-0263-9","10.1109/ICHI57859.2023.00095","","https://ieeexplore.ieee.org/stamp/stamp.jsp?arnumber=10337072","System Design;FHIR;Real-Time Processing;Artificial intelligence (AI);Applied AI","Codes;Tutorials;Medical services;Real-time systems;Data models;Feeds;Artificial intelligence","","2","","3","IEEE","11 Dec 2023","","","IEEE","IEEE Conferences"
"A Systematic Integrated Literature Review of Clinical Data Management Platforms of HL7 FHIR","F. F. Walter Viktor Walter-Tscharf","Department of Information Engineering and Computer Science, Fondazione Bruno Kessler, University of Trento, European Institute of Innovation and Technology Doctoral Program Industrial Innovation","2022 IEEE 24th Int Conf on High Performance Computing & Communications; 8th Int Conf on Data Science & Systems; 20th Int Conf on Smart City; 8th Int Conf on Dependability in Sensor, Cloud & Big Data Systems & Application (HPCC/DSS/SmartCity/DependSys)","28 Mar 2023","2022","","","2298","2307","This study is dedicated to a critical investigation of the existing approaches toward a data visualization management platform based on Fast Health Interoperability Resources (FHIR). Despite the growing popularity of FHIR, the available evidence provides a compelling reason to believe that its use is still accompanied by a significant number of technical challenges. Therefore, the development of tools to ensure its convenient visualization remains a pressing need for a variety of stakeholders operating in the healthcare industry. Results of the systematic literature review that included 26 studies provide valuable information about the most popular instruments in this area, such as the OpenEHR CKM approach. The review offers a critical discussion of the most important advantages and disadvantages of different approaches. It provides valuable recommendations for further research as well as practical recommendations concerning the best ways to utilize data visualization platforms based on FHIR. It defines the tradeoff of functionality versus the ease of dissemination as one of the most important problems facing most platforms and suggests avenues for developing additional tooling support for visualizing FHIR. The results of the research could be useful both for scientists and practitioners.","","979-8-3503-1993-4","10.1109/HPCC-DSS-SmartCity-DependSys57074.2022.00340","","https://ieeexplore.ieee.org/stamp/stamp.jsp?arnumber=10074714","FHIR;HL7 FHIR EHR;OpenEHR;CKM;SMART on FHIR","Industries;Systematics;Bibliographies;Instruments;Data visualization;Pressing;Medical services","","2","","40","IEEE","28 Mar 2023","","","IEEE","IEEE Conferences"
"Anonymization and Pseudonymization of FHIR Resources for Secondary Use of Healthcare Data","E. Raso; P. Loreti; M. Ravaziol; L. Bracciale","Department of Civil Engineering and Computer Science Engineering, University of Rome Tor Vergata, Rome, Italy; Department of Electronic Engineering, University of Rome Tor Vergata, Rome, Italy; Docunque SRL, Frascati, Italy; Department of Electronic Engineering, University of Rome Tor Vergata, Rome, Italy",IEEE Access,"29 Mar 2024","2024","12","","44929","44939","Along with the creation of medical profiles of patients, Electronic Health Records have several secondary missions, such as health economy and research. The recent, increasing adoption of a common standard, i.e., the Fast Healthcare Interoperability Resources (FHIR), makes it easier to exchange medical data among the several parties involved, for example, in an epidemiological research activity. However, this exchange process is hindered by regulatory frameworks due to privacy issues related to the presence of personal information, which allows patients to be identified directly (or indirectly) from their medical data. When properly used, de-identification techniques can provide crucial support in overcoming these problems. FHIR-DIET aims to bring flexibility and concreteness to the implementation of de-identification of health data, supporting many customised data-processing behaviours that can be easily configured and tailored to match specific use case requirements. Our solution enables faster and easier cooperation between legal and IT professionals to establish and implement de-identification rules. The performance evaluation demonstrates the viability of processing hundreds of FHIR patient information data per second using standard hardware. We believe FHIR-DIET can be a valuable tool to satisfy the current regulation requirements and help to create added-value for the secondary use of healthcare data.","2169-3536","","10.1109/ACCESS.2024.3381034","HosmartAI Project; European Union’s Horizon 2020 Research and Innovation Programme(grant numbers:101016834); PRECISION project (CUP H73C22001600002); Sardinia Region, Italy; ","https://ieeexplore.ieee.org/stamp/stamp.jsp?arnumber=10479174","Anonymisation;de-identification;FHIR;healthcare;pseudonymisation;privacy","Medical services;Standards;Information integrity;Information filtering;Biomedical imaging;Interoperability;History;Privacy;Medical treatment;Patient monitoring;Medical information systems;Legal factors;Electronic medical records;Data privacy","","2","","41","CCBYNCND","25 Mar 2024","","","IEEE","IEEE Journals"
"If You Build It, Will They Come? : An Adoption Analysis of the HL7/FHIR/Da Vinci Healthcare Interoperability Stack","B. Zenobia","Novillus LLC, Portland Oregon, USA",2022 Portland International Conference on Management of Engineering and Technology (PICMET),"14 Sep 2022","2022","","","1","14","The COVID-19 pandemic has exposed significant flaws in the exchange of electronic health information (EHI) in the United States. EHI interoperability is a top priority for the Center for Medicare and Medicaid Services (CMS) and the Office of the National Coordinator for Health IT (ONC). In July 2021 these agencies began enforcing legal mandates under the 21st Century Cures Act with the goal of achieving major EHI interoperability throughout the US by 2025. If this goal can be met, then EHI interoperability has the potential to trigger major disruption in the healthcare industry and realignment during the coming decade. Toward this end, CMS and ONC have embraced the Fast Healthcare Interoperability Resources (FHIR) framework as promoted by the Health Level Seven International (HL7) standards organization. A key unanswered question is whether HL7/FHIR is mature enough to support this national goal. This paper assesses the HL7/FHIR technology framework and the FHIR Accelerator known as the Da Vinci Project to forecast its adoption potential. Historical forecasting analogies as well as the PRISM methodology are used. The analysis identifies likely adoption risks, forecasts expected patterns of adopter behavior, and recommends strategies for mitigate risks.","2159-5100","978-1-890843-41-0","10.23919/PICMET53225.2022.9882646","","https://ieeexplore.ieee.org/stamp/stamp.jsp?arnumber=9882646","","Industries;COVID-19;Pandemics;Law;Standards organizations;Medical services;Behavioral sciences","","","","35","","14 Sep 2022","","","IEEE","IEEE Conferences"
"The data exchange between smart glasses and healthcare information systems using the HL7 FHIR standard","J. Ruminski; A. Bujnowski; T. Kocejko; A. Andrushevich; M. Biallas; R. Kistler","Gdansk University of Technology Gdansk, Poland; Gdansk University of Technology Gdansk, Poland; Gdansk University of Technology Gdansk, Poland; I Home Lab, Lucerne University of Applied Sciences and Arts, Lucerne, Switzerland; I Home Lab, Lucerne University of Applied Sciences and Arts, Lucerne, Switzerland; I Home Lab, Lucerne University of Applied Sciences and Arts, Lucerne, Switzerland",2016 9th International Conference on Human System Interactions (HSI),"4 Aug 2016","2016","","","525","531","In this study we evaluated system architecture for the use of smart glasses as a viewer of information, as a source of medical data (vital sign measurements: temperature, pulse rate, and respiration rate), and as a filter of healthcare information. All activities were based on patient/device identification procedures using graphical markers or features based on visual appearance. The architecture and particular use cases were implemented and verified using smart glasses prototypes developed under the eGlasses project and using a reference Health Level 7 Fast Healthcare Interoperability Resources (HL7 FHIR) server. The results show that information about the identified patient can be quickly retrieved from FHIR servers and annotated using voice recognition services. Smart glasses can be used in the measurement of vital signs of the observed patient, providing values of body temperature, pulse rate, and respiration rate by means of non-contact measurements. Such measurements are sufficiently reliable for medical screening and for fast data exchange using HL7 FHIR actions.","","978-1-5090-1729-4","10.1109/HSI.2016.7529684","","https://ieeexplore.ieee.org/stamp/stamp.jsp?arnumber=7529684","smart glasses;face recognition;object recognition;human-computer interaction","Glass;Temperature measurement;Object recognition;Medical services;Information systems;Biomedical imaging;Temperature sensors","","20","","32","IEEE","4 Aug 2016","","","IEEE","IEEE Conferences"
"SaECG: a new FHIR Data format revision to enable continuous ECG storage and monitoring","A. Benhamida; A. Kanas; M. Vincze; K. T. Papp; M. Abbassi; M. Kozlovszky","Doctoral School of Applied Informatics and Applied Mathematics, BioTech Research Center, EKIK, Óbuda University, Budapest, Hungary; BioTech Research Center, EKIK, Óbuda University, Budapest, Hungary; BioTech Research Center, EKIK, Óbuda University, Budapest, Hungary; BioTech Research Center, EKIK, Óbuda University, Budapest, Hungary; BioTech Research Center, EKIK, Óbuda University, Budapest, Hungary; John von Neumann Faculty of Informatics, Institute of Biomatics, Óbuda University, Budapest, Hungary",2020 IEEE 20th International Symposium on Computational Intelligence and Informatics (CINTI),"8 Jan 2021","2020","","","000115","000120","Information Technologies are enabling integrated healthcare processes with effective information exchange between the patient and the medical professionals. ECG is one of the key human vital signs, used by a vast number of clinicians. Fast Healthcare Interoperability Resources (FHIR) created by Health Level Seven International (HL7), Digital Imaging and Communications in Medicine (DICOM), and Standard communications protocol for computer assisted electrocardiography (SCP-ECG) are representing major digital health-data archiving standards. Most of these standards are using XML-based/JSON-based or binary formats. The interoperability and compatibility between the various ECG formats are valid problems since many years. ECG monitoring is a challenging process due to many factors such as time limitation, data size, or device dependent parameters such as the number of used parallel sampling channels. Nowadays' portable and wearable devices with non-invasive single-lead ECG capability are able to provide continuous long-term ECG data streaming that can last for many hours or even for weeks of monitoring. Available standards enable ECG data storage for a limited time, lasting from 30 seconds up to few minutes. FHIR is a medical data storage standard by HL7 for health data storage and exchange. In this paper, we propose a new FHIR (HL7-aECG) extension format for stream-like ECG, namely Stream-enabled annotated ECG (SaECG). The new format is validated successfully in our living lab and is capable to be used easily both by clinicians and researchers.","2471-9269","978-1-7281-8340-4","10.1109/CINTI51262.2020.9305828","","https://ieeexplore.ieee.org/stamp/stamp.jsp?arnumber=9305828","ECG;HL7;FHIR;streaming data;aECG;Monitoring;continuous vital sign monitoring","Electrocardiography;Standards;Monitoring;XML;Memory;Interoperability;DICOM","","11","","14","IEEE","8 Jan 2021","","","IEEE","IEEE Conferences"
"Providing Full Semantic Interoperability for the Fast Healthcare Interoperability Resources Schemas with Resource Description Framework","M. P. Luz; J. Rocha de Matos Nogueira; L. T. Cavalini; T. W. Cook","Medical Sciences College, Rio de Janeiro State University, Rio de Janeiro, Brazil; MLHIM Technol. Dev. Unit, Universidade do Estado do Rio de Janeiro, Rio de Janeiro, RJ, BR; Department of Healthcare Information Technology, Rio de Janeiro State University, Rio de Janeiro, Brazil; Emergent Group for Research and Innovation on Healthcare Information Technology, Rio de Janeiro State University, Rio de Janeiro, Brazil",2015 International Conference on Healthcare Informatics,"10 Dec 2015","2015","","","463","466","The Fast Healthcare Interoperability Resources (FHIR) is an open suite of specifications and software implementations of the Health Level 7 version 3 (HL7v3) standard. It has been proposed to provide a consistent API for the HL7v3 CDA. However, the core issues of HL7v3 are not solved at the API level. The community around the project are proposing the adoption of RDF technologies to overcome the current challenges in interoperating with linked data. However, RDF triples nor ontologies provide semantic interoperability by themselves, a more robust information infrastructure, such as the Multilevel Model-Driven (MMD) approach, is required. An XML implementation of the MMD was used to model the FHIR Schemas as Domain Models (DMs) against a generic Reference Model (RM) to provide syntactic validation. RDF triples were included in the domain models to provide missing semantics. The XML data instances were validated against their Domain Models. The DMs do not create any new types, they only express constraints of the RM types, this provides consistent query and data analysis capability across all DMs. RDF triples were extracted from the DMs and added to a triple store graph with the RM ontology. The XML data is also expressed as Literals in the graph. This study shows the feasibility of using MMD solutions to provide full operational semantic interoperability for the FHIR ecosystem.","","978-1-4673-9548-9","10.1109/ICHI.2015.74","","https://ieeexplore.ieee.org/stamp/stamp.jsp?arnumber=7349736","Health information systems;Information exchange;Health Level 7","Semantics;Medical services;Resource description framework;XML;Interoperability;Data models;Charge coupled devices","","11","","12","IEEE","10 Dec 2015","","","IEEE","IEEE Conferences"
"A FHIR-compliant Application for Multi-Site and Multi-Modality Pediatric Scoliosis Patient Rehabilitation","W. Shi; F. O. Giuste; Y. Zhu; A. M. Carpenter; H. J. Iwinski; C. Hilton; J. M. Wattenbarger; M. D. Wang","Georgia Institute of Technology, Atlanta, GA, USA; Georgia Institute of Technology, Atlanta, GA, USA; Georgia Institute of Technology, Atlanta, GA, USA; Georgia Institute of Technology, Atlanta, GA, USA; Georgia Institute of Technology, Atlanta, GA, USA; Georgia Institute of Technology, Atlanta, GA, USA; Georgia Institute of Technology, Atlanta, GA, USA; Georgia Institute of Technology, Atlanta, GA, USA",2021 IEEE International Conference on Bioinformatics and Biomedicine (BIBM),"14 Jan 2022","2021","","","1524","1527","Scoliosis is a spinal curvature that most frequently affects adolescents. Posterior spinal fusion surgery is required to correct the deformity in patients with severe scoliosis. Surgeons frequently use radiographic measurements and patient reported outcomes to aid in surgical treatment and monitor patient rehabilitation. Shriners Hospitals for Children is a large healthcare system caring for a significant percentage of pediatric patients with scoliosis. Surgeons from SHC-Greenville and SHC-Lexington have recorded data from more than 1,000 individual scoliosis patients. However, these collected data are usually dispersed across individual healthcare sites, necessitating the development of an integrated clinical data repository for data sharing and management. In this paper, we established a standardized research data repository with FHIR resources to harmonize multi-modal patient data from multiple clinical sites. Additionally, a FHIR-compliant application with a web-based user interface was prototyped to enable clinicians and researchers to access scoliosis patient data within our integrated and standardized research repository. Patient cohort definitions can be used to search these records using the same FHIR application. This standardized data-sharing framework and healthcare information system can be applied to multi-site and multimodality studies for clinical and research purposes, with the ultimate goal of improving the quality of patient care.","","978-1-6654-0126-5","10.1109/BIBM52615.2021.9669649","Shriners Hospitals for Children; Microsoft; ","https://ieeexplore.ieee.org/stamp/stamp.jsp?arnumber=9669649","FHIR;Data Harmonization;ETL;Application Development;Scoliosis Patient Care","Decision support systems;Pediatrics;Hospitals;Surgery;Imaging;Patient rehabilitation;Planning","","9","","4","IEEE","14 Jan 2022","","","IEEE","IEEE Conferences"
"Safety Improvement for SMART on FHIR Apps with Data Quality by Contract","J. -P. Stoldt; J. H. Weber","Department of Computer Science, University of Victoria, Victoria, BC, Canada; Department of Computer Science, University of Victoria, Victoria, BC, Canada",2020 IEEE International Conference on Software Architecture Companion (ICSA-C),"19 May 2020","2020","","","192","195","Initiatives leveraging the emerging SMART on FHIR standard are promising healthcare system improvements while reducing information technology costs with reusable system components. Previously closed Electronic Medical Record systems are gradually opened to third party applications through FHIR-enabled APIs. While this allows for technical interoperability, patient safety concerns from data quality issues with the underlying system data remain unsolved. We propose to apply a “Data Quality by Contract” approach to pre- and post-conditions of data use cases to assure safe operation of SMART on FHIR apps. We demonstrate how a cardiac risk scoring app could leverage data quality probes to validate several data quality concerns.","","978-1-7281-7415-0","10.1109/ICSA-C50368.2020.00041","","https://ieeexplore.ieee.org/stamp/stamp.jsp?arnumber=9095642","SMART on FHIR;data quality;safety;electronic medical records;software engineering;health information systems","Probes;Data integrity;Diabetes;Safety;Standards;Contracts","","6","","28","IEEE","19 May 2020","","","IEEE","IEEE Conferences"
"Opioid2FHIR: A system for extracting FHIR-compatible opioid prescriptions from clinical text","J. Wang; W. C. Mathews; H. A. Pham; H. Xu; Y. Zhang","Melax Technologies, Inc, Houston, USA; UC San Diego Health, San Diego, USA; Melax Technologies, Inc, Houston, USA; Health Science Center at Houston2, University of Texas, Houston, USA; Melax Technologies, Inc, Houston, USA",2020 IEEE International Conference on Bioinformatics and Biomedicine (BIBM),"13 Jan 2021","2020","","","1748","1751","Background: The opioid crisis is a national public health emergency in US. Especially, prescription opioids contributed significantly to drug overdose deaths. To improve the surveillance of prescription opioid overdose, it is critical to accurately collect prescription opioid information and calculate morphine milligram equivalents (MMEs). However, plenty of detailed information is only contained in the free text Sig component of electronic health record (EHR) prescriptions and need to be extracted first. Moreover, it is also indispensable to normalize opioid information extracted from multiple heath care facilities to clinical data standards such as Fast Healthcare Interoperability Resources (FHIR) for efficient clinical decision support. However, few efforts are spent in this direction at present. Methods: In this study, we designed and implemented a system that can automatically extract opioid information from free text in Sig and map them to FHIR. The system, named as Opioid2FHIR, applied multiple natural language processing (NLP) techniques for opioid information extraction and normalization. In order to reduce manual efforts, a general-purpose medication IE model was first leveraged. Based on 1, 000 opioid prescription records randomly selected from MIMICIII, post-processing rules were designed to adapt the IE model to opioid medications. Concept normalization models were also built to transform and map the extracted medication elements to fine-granular standard concepts in FHIR. The system was evaluated on another 1, 000 opioid prescription records in MIMICIII. Results: Opioid2FHIR obtained an F-measure of 0.963 for medication information extraction and an accuracy of 0.987 for medical concept normalization. Conclusions: A clinical NLP application to EHR opioid scripts would fill a current gap in available batch script processing tools and would greatly enhance individual prescription processing limitations of prescription drug monitoring programs and clinical MME calculators.","","978-1-7281-6215-7","10.1109/BIBM49941.2020.9313258","National Center for Advancing Translational Sciences; ","https://ieeexplore.ieee.org/stamp/stamp.jsp?arnumber=9313258","Opioid prescription;medication information extraction;Fast Healthcare Interoperability Resources (FHIR);natural language processing (NLP)","Drugs;Data mining;Natural language processing;MIMICs;Unified modeling language;Task analysis;Standards","","5","","15","IEEE","13 Jan 2021","","","IEEE","IEEE Conferences"
"Patient — Physician collaboration on FHIR (Fast Healthcare Interoperability Resources)","M. L. Braunstein",Georgia Institute of Technology,2015 International Conference on Collaboration Technologies and Systems (CTS),"20 Aug 2015","2015","","","501","503","With electronic health record adoption now far advanced the focus has largely shifted to interoperability - the ability to meaningfully share data among these systems and to collect and share data with devices, sensors, apps and tools increasingly available to patients. At the same time new forms of reimbursement encourage greater collaboration among providers and their patients. These twin imperatives have led to the rapid development and adoption of FHIR (Fast Healthcare Interoperability Resources), a more facile approach to representing and sharing health data based on familiar, standard technologies widely used by other industries and a potential universal health app platform. This paper explains FHIR and the impact it will potentially have on patient-physician collaboration.","","978-1-4673-7648-8","10.1109/CTS.2015.7210457","","https://ieeexplore.ieee.org/stamp/stamp.jsp?arnumber=7210457","Fast healthcare interoperability resources;health information exchange;patient-physician collaboration;electronic health records","Medical services;Collaboration;Standards;Interoperability;Electronic medical records;Data models;Informatics","","5","","10","IEEE","20 Aug 2015","","","IEEE","IEEE Conferences"
