"Personalized wearable systems for real-time ECG classification and healthcare interoperability: Real-time ECG classification and FHIR interoperability","A. Walinjkar; J. Woods","Department of Computer Science and Electronics Engineering, University of Essex, Colchester, Essex; Department of Computer Science and Electronics Engineering, University of Essex, Colchester, Essex",2017 Internet Technologies and Applications (ITA),"9 Nov 2017","2017","","","9","14","Continuous monitoring of an individual's health using wearable biomedical devices is becoming a norm these days with a large number of wearable kits becoming easily available. Modern wearable health monitoring devices have become easily available in the consumer market, however, real-time analyses and prediction along with alerts and alarms about a health hazard are not adequately addressed in such devices. Taking ECG monitoring as a case study the research paper focusses on signal processing, arrhythmia detection and classification and at the same time focusses on updating the electronic health records database in realtime such that the concerned medical practitioners become aware of an emergent situation the patient being monitored might face. Also, heart rate variability (HRV) analysis is usually considered as a basis for arrhythmia classification which largely depends on the morphology of the ECG waveforms and the sensitivity of the biopotential measurements of the ECG kits, so it may not yield accurate results. Initially, the ECG readings from the 3-Lead ECG analog front-end were de-noised, zero-offset corrected, filtered using recursive least square adaptive filter and smoothed using Savitzky-Golay filter and subsequently passed to the data analysis component with a unique feature extraction method to increase the accuracy of classification. The machine learning models trained on MITDB arrhythmia database (MIT-BIH Physionet) showed more than 97% accuracy using kNN classifiers. Neuralnet fitting models showed mean-squared error of as low as 0.0085 and regression value as high as 0.99. ECG abnormalities based on annotations in MITDB could be classified and these ECG observations could be logged to a server implementation based on FHIR standards. The instruments were networked using IoT (Internet of Things) devices and ECG event observations were coded according to SNOMED coding system and could be accessed in Electronic Health Record by the concerned medic to take appropriate and timely decisions. The system emphasizes on `preventive care rather than remedial cure' as the next generation personalized health-care monitoring devices become available.","","978-1-5090-4815-1","10.1109/ITECHA.2017.8101902","","https://ieeexplore.ieee.org/stamp/stamp.jsp?arnumber=8101902","Arrhythmia classification;Wearable IoT;Healthcare monitoring;ECG signal processing;Arrhythmia detection;Arrhythmia Neural-Net;MITDB Physionet;GP Connect;HL7;ECG FHIR;SNOMED-CT FHIR;HAPI FHIR","Electrocardiography;Monitoring;Biomedical monitoring;Databases;Adaptive filters;Real-time systems","","26","","34","IEEE","9 Nov 2017","","","IEEE","IEEE Conferences"
"ECG classification and prognostic approach towards personalized healthcare","A. Walinjkar; J. Woods","Department of Computer Science and Electronics Engineering, University of Essex, Colchester, Essex; Department of Computer Science and Electronics Engineering, University of Essex, Colchester, Essex","2017 International Conference On Social Media, Wearable And Web Analytics (Social Media)","9 Oct 2017","2017","","","1","8","A very important aspect of personalized healthcare is to continuously monitor an individual's health using wearable biomedical devices and essentially to analyse and if possible to predict potential health hazards that may prove fatal if not treated in time. The prediction aspect embedded in the system helps in avoiding delays in providing timely medical treatment, even before an individual reaches a critical condition. Despite of the availability of modern wearable health monitoring devices, the real-time analyses and prediction component seems to be missing with these devices. The research work illustrated in this paper, at an outset, focussed on constantly monitoring an individual's ECG readings using a wearable 3-lead ECG kit and more importantly focussed on performing real-time analyses to detect arrhythmia to be able to identify and predict heart risk. Also, current research shows extensive use of heart rate variability (HRV) analysis and machine learning for arrhythmia classification, which however depends on the morphology of the ECG waveforms and the sensitivity of the ECG equipment. Since a wearable 3-lead ECG kit was used, the accuracy of classification had to be dealt with at the machine learning phase, so a unique feature extraction method was developed to increase the accuracy of classification. As a case study a very widely used Arrhythmia database (MIT-BIH, Physionet) was used to develop learning, classification and prediction models. Neuralnet fitting models on the extracted features showed mean-squared error of as low as 0.0085 and regression value as high as 0.99. Current experiments show 99.4% accuracy using k-NN Classification models and show values of Cross-Entropy Error of 7.6 and misclassification error value of 1.2 on test data using scaled conjugate gradient pattern matching algorithms. Software components were developed for wearable devices that took ECG readings from a 3-Lead ECG data acquisition kit in real time, de-noised, filtered and relayed the sample readings to the tele health analytical server. The analytical server performed the classification and prediction tasks based on the trained classification models and could raise appropriate alarms if ECG abnormalities of V (Premature Ventricular Contraction: PVC), A (Atrial Premature Beat: APB), L (Left bundle branch block beat), R (Right bundle branch block beat) type annotations in MITDB were detected. The instruments were networked using IoT (Internet of Things) devices and abnormal ECG events related to arrhythmia, from analytical server could be logged using an FHIR web service implementation, according to a SNOMED coding system and could be accessed in Electronic Health Record by the concerned medic to take appropriate and timely decisions. The system focused on `preventive care rather than remedial cure' which has become a major focus of all the health care and cure institutions across the globe.","","978-1-5090-5057-4","10.1109/SOCIALMEDIA.2017.8057360","","https://ieeexplore.ieee.org/stamp/stamp.jsp?arnumber=8057360","ECG classification;Wearable IoT;preventive health-care;real-time ECG;arrhythmia detection;arrhythmia Neural-Net;MITDB;Physionet;GP Connect;HL7;FHIR","Electrocardiography;Heart;Real-time systems;Databases;Biomedical monitoring;Monitoring;Feature extraction","","16","","53","IEEE","9 Oct 2017","","","IEEE","IEEE Conferences"
"An Architectural Design for Self-Reporting E-Health Systems","S. K. Mukhiya; F. Rabbi; K. I. Pun; Y. Lamo","Western Norway University of Applied Sciences, Norway; Western Norway University of Applied Sciences, Norway; Western Norway University of Applied Sciences, Norway; Western Norway University of Applied Sciences, Norway",2019 IEEE/ACM 1st International Workshop on Software Engineering for Healthcare (SEH),"5 Sep 2019","2019","","","1","8","Worldwide, public healthcare is challenged to deliver consistent and cost-efficient services. The cost of healthcare is increasing primarily due to growing populations and more expensive treatment. Health facilities in many countries are reaching their full operational capacity, and their resources %of these hospitals are less than what is required to deliver the expected quality of care. Under these circumstances, ICT has a major role to play in mitigating the growing need for hospital care. In this paper, we present a cloud-based interoperable architecture built on the top of Service-Oriented Architecture (SOA) for Internet-based treatment where patients can directly interact with underlying healthcare systems such as Electronic Health Records (EHRs). Based on this architecture, we also present a prototype for screening and monitoring of mental and neurological health morbidities. The proposed solution is based on the healthcare interoperability standard, HL7 FHIR, that enables healthcare providers to assess and monitor patients condition in a secure environment.","","978-1-7281-2251-9","10.1109/SEH.2019.00008","","https://ieeexplore.ieee.org/stamp/stamp.jsp?arnumber=8823897","service-oriented architecture, healthcare, self-screening, HL7 FHIR, SMART on FHIR, Internet-based Treatments","Medical services;Monitoring;Service-oriented architecture;Servers;Authorization;Standards;Interoperability","","12","","45","IEEE","5 Sep 2019","","","IEEE","IEEE Conferences"
"CyPhyS+: A Reliable and Managed Cyber-Physical System for Old-Age Home Healthcare over a 6LoWPAN Using Wearable Motes","H. Dagale; S. V. R. Anand; M. Hegde; N. Purohit; M. K. Supreeth; G. S. Gill; V. Ramya; A. Shastry; S. Narasimman; Y. S. Lohith; P. Surya","Department of Electronic Systems Engineering, Indian Institute of Science; Department of Electrical Communication Engineering, Indian Institute of Science; Department of Electrical Communication Engineering, Indian Institute of Science; Department of Electronic Systems Engineering, Indian Institute of Science; Indian Institute of Science, Bangalore, Karnataka, IN; Department of Electronic Systems Engineering, Indian Institute of Science; Indian Institute of Science, Bangalore, Karnataka, IN; Department of Electronic Systems Engineering, Indian Institute of Science; Department of Electrical Communication Engineering, Indian Institute of Science; Indian Institute of Science, Bangalore, Karnataka, IN; Indian Institute of Science, Bangalore, Karnataka, IN",2015 IEEE International Conference on Services Computing,"20 Aug 2015","2015","","","309","316","We present design and implementation of CyPhyS+, a comprehensive, low-cost and standard complaint Cyber Physical System for remote health monitoring of elderly staying in old age homes. It is an end-to-end 6LoWPAN based healthcare system, which provides reliable and secured medical data acquisition, on the fly medical data analytics and visualization in real-time. It is designed for low power operations and resource constraint environment. The paper describes system architecture, design and implementation details of software and hardware sub-systems. As part of the system we developed power efficient Bluetooth-6LoWPAN mote, Health Mote. The paper describes novel energy efficient end-to-end multi-stage message reliability scheme. The experimental results prsented show the efficacy of the approach. For ensuring robust operational network, CyPhyS+ employs a low power and application aware SNMP based network monitoring for 6LoWPAN multihop network. In addition, CyPhyS+ incorporates a 128-bit AES, CBC-MAC based encryption and authentication mechanism. Other notable features of CyPhyS+ include its compliance with open FHIR/HL7 medical standards, support for Restful architecture based web services, and medical data analytics of ECG. We report on the extensive field trials that have been carried out across various parts of the city.","","978-1-4673-7281-7","10.1109/SCC.2015.50","","https://ieeexplore.ieee.org/stamp/stamp.jsp?arnumber=7207368","Cyber-Physical System;Healthcare;6LoWPAN;Wearable Mote;FHIR;HL7;ECG;IoT","Internet;Monitoring;Reliability;Medical services;Biomedical monitoring;Bluetooth;Loss measurement","","10","","11","IEEE","20 Aug 2015","","","IEEE","IEEE Conferences"
"UHF RFID and NFC Point-of-Care—Architecture, Security, and Implementation","G. M. Bianco; E. Raso; L. Fiore; V. Mazzaracchio; L. Bracciale; F. Arduini; P. Loreti; G. Marrocco; C. Occhiuzzi","Department of Civil Engineering and Computer Science Engineering, Pervasive Electromagnetics Laboratory, University of Rome “Tor Vergata”, Rome, Italy; Department of Electronic Engineering, University of Rome “Tor Vergata”, Rome, Italy; Department of Chemical Science and Technologies, NanoBioSensing Laboratory, University of Rome “Tor Vergata”, Rome, Italy; Department of Chemical Science and Technologies, NanoBioSensing Laboratory, University of Rome “Tor Vergata”, Rome, Italy; Department of Electronic Engineering, University of Rome “Tor Vergata”, Rome, Italy; Department of Chemical Science and Technologies, NanoBioSensing Laboratory, University of Rome “Tor Vergata”, Rome, Italy; Department of Electronic Engineering, University of Rome “Tor Vergata”, Rome, Italy; Department of Civil Engineering and Computer Science Engineering, Pervasive Electromagnetics Laboratory, University of Rome “Tor Vergata”, Rome, Italy; Department of Civil Engineering and Computer Science Engineering, Pervasive Electromagnetics Laboratory, University of Rome “Tor Vergata”, Rome, Italy",IEEE Journal of Radio Frequency Identification,"20 Jul 2023","2023","7","","301","309","Points-of-care (PoCs) augment healthcare systems by performing care whenever needed and are becoming increasingly crucial for the well-being of the worldwide population. Personalized medicine, chronic illness management, and cost reduction can be achieved thanks to the widespread adoption of PoCs. Significant incentives for PoCs deployment are nowadays given by wearable devices and, in particular, by RFID (RadioFrequency IDentification) and NFC (Near Field Communication), which are rising among the technological cornerstones of the healthcare Internet of Things (H-IoT). To fully exploit recent technological advancements, this paper proposes a system architecture for RFID- and NFC-based PoCs. The architecture comprises in a unitary framework both interfaces to benefit from their complementary features, and gathered data are shared with medical experts through secure and user-friendly interfaces that implement the Fast Health Interoperability Resource (FHIR) emerging healthcare standard. The selection of the optimal UHF and NFC components is discussed concerning the employable sensing techniques. The secure transmission of sensitive medical data is addressed by developing a user-friendly “PoC App” that is the first Web app exploiting attribute-based encryption (ABE). An application example of the system for monitoring the pH and cortisol levels in sweat is implemented and preliminarily tested by a healthy volunteer.","2469-7281","","10.1109/JRFID.2023.3268422","Regione Lazio, Project E-CROME (biosEnsori su Carta wiReless per la telemedicina in Oncologia e la misura di eMocromo ed Elettroliti; Development of NFC Interface Sensors for the Measurement of Biomarkers in Blood)(grant numbers:E85F21001040002); ","https://ieeexplore.ieee.org/stamp/stamp.jsp?arnumber=10106459","Cybersecurity;electrochemical sensors;fast health interoperability resources;healthcare Internet of Things systems;Near Field Communication;radiofrequency identification","Medical services;Sensors;Radiofrequency identification;Monitoring;Temperature sensors;Near field communication;Chemicals;Computer security;Electrochemical devices;Internet of Medical Things","","8","","78","IEEE","21 Apr 2023","","","IEEE","IEEE Journals"
"A Unified Deep Learning Diagnostic Architecture for Big Data Healthcare Analytics","S. Shafqat; Z. Anwar; Q. Javaid; H. F. Ahmad","Department of Basic and Applied Sciences, International Islamic University (IIUI), Islamabad, Pakistan; Department of Computer Science and Sheila and Robert, Challey Institute for Global Innovation and Growth, North Dakota State University (NDSU), Fargo, ND, USA; Department of Basic and Applied Sciences, International Islamic University (IIUI), Islamabad, Pakistan; Computer Science Department, College of Computer Sciences and Information Technology (CCSIT), King Faisal University, Al-Ahsa, Kingdom of Saudi Arabia",2023 IEEE 15th International Symposium on Autonomous Decentralized System (ISADS),"7 Apr 2023","2023","","","1","8","Healthcare automation is evolving rapidly as can been seen in the recent popularity of e-health or digital health systems. The massive amount of health related data produced by these systems has given rise to the field of health informatics. The World Health organization (WHO) decomposes SMARThealth as Standards-based, Machine-readable, Adaptive, Requirementsbased, and Testable, and provides guidelines for digital health. Heterogeneous and big health data health that flows into the cloud requires considerations for uniformity of structure to allow for interoperability and generalizability for universal use and analysis. This research proposes a deep-learning architecture for disease diagnosis that considers Diabetes Mellitus (DM) as a case study. Three corpuses containing DM patient data are considered which are prepared and processed using extensive data warehousing techniques and labeled with ICD-10-CM diagnostic codes. Extraction of desired health data is through a unified data model for healthcare that is in compliance with HL7 FHIR v4.0 schema. Our contributions are two-fold: First, three big data cloud analytical models are proposed and validated on the unified corpora and second the maximum possible diseases specific to a single or multiple DM patients have been diagnosed with a 100% accuracy using deep multinomial/multi-label distribution learning (DMDL).","2640-7485","978-1-6654-6451-2","10.1109/ISADS56919.2023.10092137","","https://ieeexplore.ieee.org/stamp/stamp.jsp?arnumber=10092137","deep learning;diagnostic architecture;healthcare analytics;HPC;big data","Warehousing;Standards organizations;Organizations;Big Data;Electronic healthcare;Diabetes;Medical diagnosis","","7","","22","IEEE","7 Apr 2023","","","IEEE","IEEE Conferences"
"A Blockchain-based Secured and Privacy-Preserved Personal Healthcare Record Exchange System","H. D. Hoang; D. Thi Thu Hien; T. C. Nhut; P. Dang Truc Quyen; P. T. Duy; V. -H. Pham","Information Security Laboratory, University of Information Technology, VNU-HCM; Information Security Laboratory, University of Information Technology, VNU-HCM; Information Security Laboratory, University of Information Technology, VNU-HCM; Information Security Laboratory, University of Information Technology, VNU-HCM; Information Security Laboratory, University of Information Technology, VNU-HCM; Information Security Laboratory, University of Information Technology, VNU-HCM",2021 IEEE International Conference on Machine Learning and Applied Network Technologies (ICMLANT),"2 Feb 2022","2021","","","1","5","The demand for personal healthcare record (PHR) exchange among electronic medical record (EMR) systems and patients is growing along with remarkable efforts to improve the quality, safety, privacy-preserving, and efficiency of healthcare information delivery. Currently, in EMR systems, there are problems of fragmented communication and lack of interoperability for health care professionals, hospitals, clinics and patients to appropriately access and securely share a patient’s EMR. Moreover, in the context of the recent soaring of security breaches and surveillance in incidents reported, a solution to ensure the safety and privacy of data is essential. Blockchain can ensure trust, security, and privacy of individual data in the digital world. By leveraging blockchain features, we propose HoloCare system for providing a single source from the patient’s PHR for authentication, permission granting and remote access to the health information data from other EMR systems. To demonstrate the practicability and effectiveness of HoloCare, we utilize HL7 FHIR, known as a standard for healthcare data exchange in a wide variety of contexts from PHR-based data sharing, server communication among and within healthcare providers.","","978-1-6654-4950-2","10.1109/ICMLANT53170.2021.9690542","","https://ieeexplore.ieee.org/stamp/stamp.jsp?arnumber=9690542","blockchain;FHIR;personal healthcare record;electronic medical record","Data privacy;Hospitals;Surveillance;Medical services;Streaming media;Blockchains;Safety","","7","","16","IEEE","2 Feb 2022","","","IEEE","IEEE Conferences"
"Formal reliability analysis of Device Interoperability Middleware (DIM) based E-health system using PRISM","U. Pervez; A. Mahmood; O. Hasan; K. Latif; A. Gawanmeh","School of Electrical Engineering and Computer Science, National University of Sciences & Technology, Islamabad, Pakistan; School of Electrical Engineering and Computer Science, National University of Sciences & Technology, Islamabad, Pakistan; School of Electrical Engineering and Computer Science, National University of Sciences & Technology, Islamabad, Pakistan; School of Electrical Engineering and Computer Science, National University of Sciences & Technology, Islamabad, Pakistan; Department of Electrical and Computer Engineering, Khalifa University, UAE","2015 17th International Conference on E-health Networking, Application & Services (HealthCom)","19 Apr 2016","2015","","","108","113","Ensuring the correctness of middleware that ensures interoperability of various medical devices is one of the biggest challenges in the e-health domain. Traditionally, these Device Interoperability Middleware (DIM) are analyzed using software testing. However, given the inherent incompleteness of testing and the randomness of the user behaviours, the analysis results are not guaranteed to be accurate. Some of these inaccuracies in analysis results could even put human life at risk. In order to overcome these limitations, we propose to use a probabilistic model checker PRISM for analyzing DIM. The proposed approach allows us to rigorously verify reliability properties of the given DIM and thus allows the designers to make appropriate measures to design more reliable systems. For illustration, we formally analyze a middleware that uses the HL7 FHIR and ontology-based description of the devices and a communication protocol to bridge the gap in heterogeneity for dealing with different vendors and incompatible data formats.","","978-1-4673-8325-7","10.1109/HealthCom.2015.7454482","","https://ieeexplore.ieee.org/stamp/stamp.jsp?arnumber=7454482","","Reliability;Middleware;Probabilistic logic;Probability;Interoperability;Analytical models;Medical services","","6","","29","IEEE","19 Apr 2016","","","IEEE","IEEE Conferences"
