"Services, Processes and Policies for Digital Health: FHIR® Case Study","Z. Milosevic; A. Bond","Deontik Pty Ltd, Australia; NEHTA, Australia",2016 IEEE 20th International Enterprise Distributed Object Computing Workshop (EDOCW),"10 Oct 2016","2016","","","1","10","This paper provides a number of recommendations for expressing the behavioral semantics of a digital health enterprise. This includes the specification of policies, processes and services, with a particular focus on the RM-ODP enterprise and computational concerns. We believe that these behavioral aspects are needed to complement well developed expression of information semantics. The paper is motivated by the need for better approaches to expressing behaviour in the emerging FHIR® standard and providing a solid architecture framework to practitioners when using FHIR. However, the concepts and ideas are more general and can be applied to other technologies when building digital health solutions.","2325-6605","978-1-4673-9933-3","10.1109/EDOCW.2016.7584387","","https://ieeexplore.ieee.org/stamp/stamp.jsp?arnumber=7584387","","Standards;Unified modeling language;Semantics;Medical services;Interoperability;Computational modeling;Computer architecture","","1","","15","IEEE","10 Oct 2016","","","IEEE","IEEE Conferences"
"Design of a FHIR interface for wearable healthcare devices","J. Lee; S. Jang; E. Park","Dept. Computer Science, Jeju National University, Jeju City, Rep. of Korea; Dept. Computer Science, Jeju National University, Jeju City, Rep. of Korea; School of Medicine, Yonsei University, Seoul, Rep. of Korea",2023 Fourteenth International Conference on Ubiquitous and Future Networks (ICUFN),"7 Aug 2023","2023","","","730","732","This paper designs a FHIR (Fast Healthcare Interoperable Resources) interface to provide a standard clinical data exchange for personal wearable healthcare devices, aiming at taking them as a part of remote medical services. In uploading, the agent converts the series of sensor readings, such as electrocardiogram, to the JSON-based standard format, divides it into several subparts if necessary, finds the references to relevant resources, and submits the request via RESTful API. For download, a Python client specifies the set of search parameters, gets the target resources from the server, converts them to the language-specific data structure, and hands over to the analysis module. Our testbed is implemented, making use of diverse FHIR tools including the FRED resource editor and the HAPI server.","2165-8536","979-8-3503-3538-5","10.1109/ICUFN57995.2023.10199866","","https://ieeexplore.ieee.org/stamp/stamp.jsp?arnumber=10199866","FHIR standard;stream data resource;medical record sharing;data exchange mechanism","Access control;Restful API;Process control;Medical services;Data structures;Data models;Planning","","1","","7","IEEE","7 Aug 2023","","","IEEE","IEEE Conferences"
"Medical Systems Open Data Exchange Interconnection and Web Questionnaires Based on the HL7 FHIR Standards","R. Sfat; C. V. Marian","Faculty of Electronics, Telecommunications and Information Technology, University Politehnica of Bucharest, Bucharest, Romania; The Faculty of Engineering in Foreign Languages (FILS), University Politehnica of Bucharest, Bucharest, Romania",2022 E-Health and Bioengineering Conference (EHB),"2 Jan 2023","2022","","","01","04","Due to the unprecedented development of information technology, the medical systems have adopted these new technologies and innovations. Thus, medical informatics, telemedicine, eHealth have become terms widely used today and more and more often in the medical systems. In order to make the most of the potential offered by IT in medicine, there is a need to openly interconnect different data processing systems. In order to make this interconnection as efficient as possible, it is necessary to create a common language. This is how the Health Level 7 (HL7) standard and the latest ISO / ANSI HL7 FHIR (Fast Healthcare Interoperability Resources) version appeared. This paper presents an application to dynamically create web based questionnaires and to collect answers. The medical systems open interconnection is implemented using the HL7 FHIR standards.","2575-5145","978-1-6654-8557-9","10.1109/EHB55594.2022.9991574","","https://ieeexplore.ieee.org/stamp/stamp.jsp?arnumber=9991574","HL7;FHIR;questionnaire;JSON;data types","Technological innovation;Telemedicine;ISO Standards;Focusing;Natural language processing;Information technology;Informatics","","1","","15","IEEE","2 Jan 2023","","","IEEE","IEEE Conferences"
"Fast Healthcare Interoperability Resources Profiling of Korea Frailty and Aging Cohort Study Questionnaire","K. J. Won; A. R. Lee; E. Lee; I. K. Kim","Dept. of Computer Science, Engineering College of IT, Kyungpook National University, Daegu, South Korea; Dept. of Computer Science, Engineering College of IT, Kyungpook National University, Daegu, South Korea; College of Nursing Science, Kyungpook National University, Daegu, South Korea; Dept. of Computer Science, Engineering College of IT, Kyungpook National University, Daegu, South Korea",2019 IEEE International Conference on Bioinformatics and Biomedicine (BIBM),"6 Feb 2020","2019","","","1259","1261","The rapid increase in the elderly population is increasing the demand for effective elderly health care as the demand for health care for the elderly increases. Existing medical services have relied on hospital or genetic information to improve the health of the elderly. However, recent studies have shown that the health status of older people is more affected by social determinants of health (SDoH) than medical and genetic information. Therefore, in order to understand the health status of the elderly in detail, it is necessary to consider SDoH. However, integrating SDoH into a hospital EHR system has a problem that it is difficult to share SDoH between hospitals because the EHR system uses a different format for each hospital. Therefore, if the elderly are to be seen at another hospital, compatibility should be supported so that SDoH can be referred to. This study utilizes SDoH measurement tools such as smoking, drinking, physical activity, social function, etc. used by KFACS, an institution that identifies and analyzes the causes and effects of senility in elderly people. We aim to use SDoH to comprehensively assess the health status of older people and to use it for successful senior health care at an older age. In addition, it builds a system that is profiled with international standard technology, FHIR Resource, and stored and managed by FHIR server.","","978-1-7281-1867-3","10.1109/BIBM47256.2019.8983284","","https://ieeexplore.ieee.org/stamp/stamp.jsp?arnumber=8983284","SDOH;EHR;KFACS;FHIR Resource;Profiling","","","","","7","IEEE","6 Feb 2020","","","IEEE","IEEE Conferences"
"Design of an ECG Stream Analysis Framework Based on FHIR Data Model","J. Lee; J. Kim","Dept. Data Science, Jeju National University, Jeju City, Rep. of Korea; Jeju Research Branch, Seers Techonology, Inc., Jeju City, Rep. of Korea",2024 Fifteenth International Conference on Ubiquitous and Future Networks (ICUFN),"20 Aug 2024","2024","","","567","569","This paper designs an ECG stream analysis framework based on the FHIR model, integrating Google Cloud services, including Healthcare APIs. Its aim is to provide an efficient cooperation environment for medical groups, fully exploiting the standardization of complex medical records. After the resource storage is created in the cloud and an external access interface is installed on a remote PC, an application can access the ECG stream resource stored in the cloud, promisingly combining diverse data analysis and artificial intelligence utilities. Most data-centric interactions are executed via the commonly used web interface, supporting CRUD operations. The FHIR standard makes it possible to locate the exact resource in the complex web request and response messages that embed multiple descriptive resources.","2165-8536","979-8-3503-8529-8","10.1109/ICUFN61752.2024.10624850","","https://ieeexplore.ieee.org/stamp/stamp.jsp?arnumber=10624850","ECG data stream;FHIR;Google Cloud;Healthcare API;Remote application","Analytical models;Medical services;Electrocardiography;Streaming media;Libraries;Internet;Artificial intelligence","","","","9","IEEE","20 Aug 2024","","","IEEE","IEEE Conferences"
"A Multi-Agent Architecture for Privacy-Preserving Natural Language Interaction with FHIR-Based Electronic Health Records","C. De Maio; G. Fenza; D. Furno; T. Grauso; V. Loia","Dept. Computer Science, University of Salerno, Salerno, Italy; Dept. Management and Innovation Systems, University of Salerno, Salerno, Italy; Dept. Management and Innovation Systems, University of Salerno, Salerno, Italy; Dept. Computer Science, University of Salerno, Salerno, Italy; Dept. Management and Innovation Systems, University of Salerno, Salerno, Italy","2024 International Conference on Software, Telecommunications and Computer Networks (SoftCOM)","23 Oct 2024","2024","","","1","6","Integrating Electronic Health Records (EHRs) into clinical workflows is essential for enhancing healthcare delivery but poses significant challenges, such as improving human-machine interaction through natural language queries. This paper addresses these challenges by leveraging Large Language Models (LLMs) within a multi-agent architecture. The aim is to develop a privacy-preserving method enabling clinicians to interact with FHIR-based EHRs using natural language. The novelty of the proposed technique lies in using publicly available LLMs to construct URIs for retrieving FHIR resources and a local LLM to interpret these resources, thus safeguarding patient privacy by preventing direct exposure of sensitive data. Evaluated with the SyntheticMass dataset, the multi-agent system demonstrated superior accuracy and detail over a single-model approach while maintaining competitive response times.","1847-358X","978-953-290-138-2","10.23919/SoftCOM62040.2024.10721684","Health; ","https://ieeexplore.ieee.org/stamp/stamp.jsp?arnumber=10721684","Electronic Health Records (EHRs);Large Language Models (LLMs);Natural Language Query Processing (NLQP);Privacy Preservation;FHIR;Multi-Agent Architecture","Query processing;Large language models;Natural languages;Computer architecture;Medical services;Software;Telecommunications;Time factors;Electronic medical records;Multi-agent systems","","","","22","","23 Oct 2024","","","IEEE","IEEE Conferences"
"An Integration of Personal Health Device and HL7 FHIR Using CoAP","C. Leksrisawat; T. Samanchuen","Technology of Information System Management Division, Faculty of Engineering, Mahidol University, Nakorn Pathom, Thailand; Technology of Information System Management Division, Faculty of Engineering, Mahidol University, Nakorn Pathom, Thailand","2021 4th International Conference on Circuits, Systems and Simulation (ICCSS)","28 Jun 2021","2021","","","1","5","In the field of health care, various electronic instruments are applied. These devices have different types of data formats depending on the service provider. For this work, the integration of IoT technology and electronic health record system is proposed where HL7 FHIR standard and CoAP protocol are selected to overcome this problem. The communication protocols for IoT including CoAP and MQTT were compared in terms of data transfer package size and Round Trip Time (RTT). The experimental result shows that RTT of CoAP smaller than RTT of MQTT while the packages of CoAP are smaller than MQTT as expected. We can see that the proposed system with HL7 FHIR can create a system interconnect between personal health devices and databases seamlessly. The proposed system can apply to various applications of the health care domain.","","978-1-7281-6752-7","10.1109/ICCSS51193.2021.9464189","","https://ieeexplore.ieee.org/stamp/stamp.jsp?arnumber=9464189","Internet of Things (IoT);Personal Health Devices (PHDs);HL7 FHIR;CoAP;MQTT","Protocols;Databases;Instruments;Integrated circuit interconnections;Medical services;Servers;Internet of Things","","","","17","IEEE","28 Jun 2021","","","IEEE","IEEE Conferences"
"Designing a Testing Environment for the CAPABLE Telemonitoring and Coaching Platform","G. Lanzola; F. Polce; V. Tibollo; S. Quaglini; S. Wilk","Dept. Electrical, Computer and Biomedical Engineering, University of Pavia, Pavia, Italy; Dept. Electrical, Computer and Biomedical Engineering, University of Pavia, Pavia, Italy; Lab. of Systems Science and Clinical Research Istituti Clinici Scientifici Maugeri, Pavia, Italy; Dept. Electrical, Computer and Biomedical Engineering, University of Pavia, Pavia, Italy; Institute of Computing Science Poznan, Univ. of Technology, Poznan, Poland",2022 IEEE 21st Mediterranean Electrotechnical Conference (MELECON),"3 Aug 2022","2022","","","1112","1117","The CAPABLE project has been funded by the European Union to develop a telemonitoring and coaching platform improving the quality of life for cancer patients. The platform, based on a multi agent blackboard architecture, is classified as a medical device according to the current EU regulation. Thus it needs extensive tests before being put into service for the planned clinical trials, which calls for a dedicated simulating and testing environment. Materials and Methods: Coordination in CAPABLE is achieved through the Case Manager, a component able to generate and notify events to other interested agent components. For representing and exchanging health care information we have adopted HL7 FHIR as a semantic interoperability standard. Results: FHIR has been exploited to design a structured history of a real patient affected by renal cell carcinoma. A simulator has been developed for automating the whole testing process represented by specific scenarios of the patient’s history. Conclusions: The simulator relies on the events produced by the Case Manager for coordinating the agents. This proved to be effective in checking that the agents reactions to new data showing up on the blackboard comply with the expected behavior.","2158-8481","978-1-6654-4280-0","10.1109/MELECON53508.2022.9843001","","https://ieeexplore.ieee.org/stamp/stamp.jsp?arnumber=9843001","Health technology assessment;distributed system testing;patient coaching;mHealth","Medical devices;Microprocessors;Semantics;Computer architecture;Medical services;Regulation;History","","","","13","IEEE","3 Aug 2022","","","IEEE","IEEE Conferences"
"A Security Model of Multihospital FHIR Database Authorization Based on Secret Sharing and Blockchain","C. -N. Yang; P. Li; H. -H. Cheng; H. -C. Kuo; M. -C. Lu; L. Xiong","Department of Computer Science and Information Engineering, National Dong Hwa University, Hualien, Taiwan; Department of Mathematics and Physics and the Hebei Key Laboratory of Physics and Energy Technology, North China Electric Power University, Baoding, China; Department of Computer Science and Information Engineering, National Dong Hwa University, Hualien, Taiwan; Department of Computer Science and Information Engineering, National Dong Hwa University, Hualien, Taiwan; Department of Computer Science and Information Engineering, National Dong Hwa University, Hualien, Taiwan; School of Computer and Software, Nanjing University of Information Science and Technology, Nanjing, China",IEEE Internet of Things Journal,"8 Mar 2024","2024","11","6","10325","10335","Secret sharing (SS) is a threshold technology that shares a secret value by generating and distributing  ${n}$  shares in the way that a set of any  ${k}$  shares can recover the secret. On the other hand, blockchain is a decentralized system establishing a secure data structure for storing data in the form of a hash chain. Combining SS and blockchain is definitely a promising paradigm in the data security field. Recently, the fast healthcare interoperability resources (FHIRs) standard is defined for medical data exchange across various medical institutions. In this article, we combine SS, ElGamal’s encryption/decryption, and blockchain to propose a multihospital FHIR database authorization (MFDA). To achieve a secure MFDA, the group-based SS (GSS) and the notion using GSS on exponent (referred to as EGSS) are proposed. The secrets of GSS and EGSS have the discrete logarithm problem (DLP) relation, on which the secrets can be used as ElGamal’s private key and public key, respectively. Also, their shares will have DLP relation. By uploading public shares of EGSS on blockchain and using private shares of GSS in a private network, we can recover ElGamal’s public key from a deployed smart contract on blockchain and recover ElGamal’s private key from a qualified set. Meantime, when recovering private key, the private shares of GSS can be authenticated by public shares on blockchain to check tampering and corrupted of private shares during the communication in a private network. Theorems, examples, and experiments demonstrate that the proposed MFDA has efficient and secure database authorization.","2327-4662","","10.1109/JIOT.2023.3328989","National Science and Technology Council(grant numbers:NSTC 112-2221-E-259-007-MY2); ","https://ieeexplore.ieee.org/stamp/stamp.jsp?arnumber=10308584","Blockchain;discrete logarithm problem (DLP);fast healthcare interoperability resources (FHIRs);Lagrange interpolation (LI);secret sharing (SS)","Blockchains;Additives;Databases;Hospitals;Cryptography;Interoperability;Authorization","","","","33","IEEE","3 Nov 2023","","","IEEE","IEEE Journals"
"Enhancing Real-Time Clinical Decision-Making through AI-Integrated FHIR Solutions: A Medplum Implementation","T. K. H. Le; W. Kongsiriwattana; C. Nimyungdee; R. Kaewsaeng-On; A. Meny; K. Namee","Vietnam - Korea University of Information and Communications Technology, University of Danang, Danang, Vietnam; Faculty of Industrial Technology and Management, King Mongkut's University of Technology North Bangkok, Bangkok, Thailand; Primaham(Thailand) Co., LTD., Prachinburi, Thaialnd; Prince of Songkla University, Songkla, Thailand; King Saud bin Abdulaziz University for Health Sciences, Jeddah, Saudi Arabia; Faculty of Industrial Technology and Management, King Mongkut's University of Technology North Bangkok, Bangkok, Thailand",2024 International Conference on Intelligent Computing and Next Generation Networks (ICNGN),"14 Feb 2025","2024","","","1","5","In recent years, the healthcare sector has experienced rapid advancements in data interoperability, artificial intelligence (AI), and real-time decision support systems. Fast Healthcare Interoperability Resources (FHIR), an open standard for healthcare data sharing, has emerged as a key framework for facilitating interoperability among healthcare platforms. This paper presents a comprehensive analysis of integrating FHIR with Medplum, an open-source platform, to enhance real-time clinical decision-making through AI-driven solutions. The system was evaluated in real-world settings, demonstrating significant improvements in both efficiency and accuracy. The AI-powered clinical documentation system reduced the time healthcare providers spent on paperwork by 50%, enabling them to allocate more time to direct patient care. Furthermore, the system lowered documentation error rates from 6% to 2% under low-load conditions and from 10% to 4% under high-load conditions, resulting in an average error reduction of 60%. Additionally, the system exhibited strong scalability, maintaining acceptable response times as the number of users increased. Response times rose from 50 milliseconds (ms) under low-load conditions to 300 ms under extremely high-load conditions (1000 users).","","979-8-3315-2922-2","10.1109/ICNGN63705.2024.10871916","King Mongkut's University of Technology North Bangkok(grant numbers:KMUTNB-65-BASIC-41); ","https://ieeexplore.ieee.org/stamp/stamp.jsp?arnumber=10871916","FHIR;Medplum;Real-time Decision Support;AI in Healthcare;Healthcare Interoperability","Error analysis;Scalability;Medical services;Documentation;Real-time systems;Time factors;Artificial intelligence;Interoperability;Standards;Next generation networking","","","","11","IEEE","14 Feb 2025","","","IEEE","IEEE Conferences"
"Medical Device Integration for Clinical Decision Support System using SMART on FHIR","B. Gokul","Digital Products and Services, L&T Technology Services Ltd., Mysuru, India","2022 Fourth International Conference on Emerging Research in Electronics, Computer Science and Technology (ICERECT)","15 Mar 2023","2022","","","1","5","With the advancement in healthcare technology, sharing of the healthcare data has become a primary need for the hospitals and the diagnostic centers. Exchange of healthcare data usually follows HL7 (Health Level 7) standard. Latest among HL7 is FHIR (Fast Healthcare Interoperability Resources). In this paper, we look into an idea to connect the diagnostic devices such as hematology analyzers with the Electronic Medical Records (EMR), to transfer the analysis to the care givers as soon it is done. We also provide an example of how this can be used in early detection of some of the medical conditions such as sepsis, chronic conditions, and other clinical decision support systems, where it needs immediate treatment from the care givers and how the SMART on FHIR helps to achieve the same","","978-1-6654-5635-7","10.1109/ICERECT56837.2022.10060121","","https://ieeexplore.ieee.org/stamp/stamp.jsp?arnumber=10060121","SMART on FHIR;Healthcare Data Exchange;HL7;EMR;CDSS","Decision support systems;Pediatrics;Ventilators;Medical devices;Surgery;Sepsis;Prediction algorithms","","","","14","IEEE","15 Mar 2023","","","IEEE","IEEE Conferences"
"A Patient-Centric Interoperable, Quorum-based Healthcare System for Sharing Clinical Data","M. George; A. M. Chacko","Dept.of CSE, National Institute of Technology, Calicut, Kerala, India; Dept.of CSE, National Institute of Technology, Calicut, Kerala, India",2022 International Conference for Advancement in Technology (ICONAT),"10 Mar 2022","2022","","","1","6","In the current Electronic Medical Record (EMR) systems, the healthcare organizations have the ownership of patient's EMR. Patients have only limited information of the EMR in the form of discharge summary and reports. This was viewed a problem in eHealth consultations during a pandemic like COVID-19, when doctors does not have access to patient data. Patient is the owner of the data and patient should have control over his medical data and should be able to share the data according to his requirement. So currently work is being undertaken to develop patient-centric EMR system. One major challenge here is to ensure the privacy and access management of data being accessed and shared. This paper aims to solve these challenges by using a permissioned blockchain network based FHIR solution for secure interoperability. The proposed system was evaluated by developing a prototype on Quorum Blockchain. The throughput and latency characteristics of the system was analyzed with different workloads and results was promising.","","978-1-6654-2577-3","10.1109/ICONAT53423.2022.9725924","","https://ieeexplore.ieee.org/stamp/stamp.jsp?arnumber=9725924","Interoperability;Electronic Medical Record(EMR);Quorum Blockchain;Patient-Centric;Healthcare","Hospitals;Pandemics;Prototypes;Organizations;Throughput;Real-time systems;Blockchains","","8","","9","IEEE","10 Mar 2022","","","IEEE","IEEE Conferences"
"GraphQL Patient Case Presentation using the Problem Oriented Medical Record Schema","S. Mohammed; J. Fiaidhi; D. Sawyer","Department of Computer Science, Lakehead University, Thunder Bay, Canada; Department of Computer Science, Lakehead University, Thunder Bay, Canada; Department of Computer Science, Lakehead University, Thunder Bay, Canada",2021 IEEE International Conference on Big Data (Big Data),"13 Jan 2022","2021","","","4738","4744","Physicians and Clerkships follow the SOAP note in describing and presenting patient cases. The SOAP note was originated from the problem-oriented medical record (POMR) developed nearly 60 years ago by Lawrence Weed, MD. However, the POMR/SOAP is not commonly found in electronic medical records (EMR) used today due to the flexible nature of building patient cases that requires complex harmonization with variety of patient case schemas. In this article we attempted to use the GraphQL API for harmonizing patient case data communicated with different care interface and providing the query on the data. This harmonization interface is called QL4POMR as a GraphQL implementation to the POMR SOAP note. Physicians can used this interface to describe and present any patient case for the purpose of diagnosis and prognosis with a varying backend. The QL4POMR implemented a mapping module to map graphs from POMR to HL7 FHIR and vise versa.","","978-1-6654-3902-2","10.1109/BigData52589.2021.9671394","","https://ieeexplore.ieee.org/stamp/stamp.jsp?arnumber=9671394","POMR;SOAP;GraphQL;e-Diagnosis;HL7 FHIR;Patient Case Presentation","Social networking (online);Soft sensors;Semantics;Medical services;Big Data;Predictive models;Simple object access protocol","","6","","10","IEEE","13 Jan 2022","","","IEEE","IEEE Conferences"
