"Authors","Author full names","Author(s) ID","Title","Year","DOI","Link"
"Walton N.; Heale B.; Formea C.","Walton, Nephi (57207105246); Heale, Bret (8918857100); Formea, Christine (6506311938)","57207105246; 8918857100; 6506311938","Clinical decision support methods and infrastructure","2022","10.1016/B978-0-12-824453-1.00001-4","https://www.scopus.com/inward/record.uri?eid=2-s2.0-85137513117&doi=10.1016%2fB978-0-12-824453-1.00001-4&partnerID=40&md5=47e779470a8bcd162f6e045c0f447a19"
"Walonoski J.; Hall D.; Bates K.M.; Farris M.H.; Dagher J.; Downs M.E.; Sivek R.T.; Wellner B.; Gregorowicz A.; Hadley M.; Campion F.X.; Levine L.; Wacome K.; Emmer G.; Kemmer A.; Malik M.; Hughes J.; Granger E.; Russell S.","Walonoski, Jason (14049438700); Hall, Dylan (57201069699); Bates, Karen M. (57567756500); Farris, M. Heath (55325841800); Dagher, Joseph (6602285963); Downs, Matthew E. (38561157400); Sivek, Ryan T. (57567756600); Wellner, Ben (15069791200); Gregorowicz, Andrew (6504647035); Hadley, Marc (57611326700); Campion, Francis X. (8982525100); Levine, Lauren (57567959700); Wacome, Kevin (57568152900); Emmer, Geoff (57112331100); Kemmer, Aaron (57567356800); Malik, Maha (57566757000); Hughes, Jonah (57568153000); Granger, Eldesia (57474503600); Russell, Sybil (57931735300)","14049438700; 57201069699; 57567756500; 55325841800; 6602285963; 38561157400; 57567756600; 15069791200; 6504647035; 57611326700; 8982525100; 57567959700; 57568152900; 57112331100; 57567356800; 57566757000; 57568153000; 57474503600; 57931735300","The “Coherent Data Set”: Combining Patient Data and Imaging in a Comprehensive, Synthetic Health Record","2022","10.3390/electronics11081199","https://www.scopus.com/inward/record.uri?eid=2-s2.0-85127862383&doi=10.3390%2felectronics11081199&partnerID=40&md5=8829a84ffafd8db876ebc5cd50524693"
"Lee H.A.; Wu W.-C.; Kung H.-H.; Udayasankaran J.G.; Wei Y.-C.; Kijsanayotin B.; Marcelo A.B.; Hsu C.-Y.","Lee, Hsiu An (57202740385); Wu, Wei-Chen (12807634400); Kung, Hsin-Hua (57201734286); Udayasankaran, Jai Ganesh (57205028068); Wei, Yu-Chih (36669497200); Kijsanayotin, Boonchai (22034695800); Marcelo, Alvin B. (23497830600); Hsu, Chien-Yeh (55752327900)","57202740385; 12807634400; 57201734286; 57205028068; 36669497200; 22034695800; 23497830600; 55752327900","Design of a Vaccine Passport Validation System Using Blockchain-based Architecture: Development Study","2022","10.2196/32411","https://www.scopus.com/inward/record.uri?eid=2-s2.0-85129778687&doi=10.2196%2f32411&partnerID=40&md5=2766f1c3886845988877e0f79d2a3ab2"
"Szabó Z.; Bilicki V.","Szabó, Zoltán (58829305800); Bilicki, Vilmos (6503856058)","58829305800; 6503856058","Evaluation of EHR Access Control in a Heterogenous Test Environment","2021","10.14232/ACTACYB.290283","https://www.scopus.com/inward/record.uri?eid=2-s2.0-85123454402&doi=10.14232%2fACTACYB.290283&partnerID=40&md5=257c08529576d6abb5db227e827ab600"
"Gómez D.; Romero J.; López P.; Vázquez J.; Cappo C.; Pinto D.; Villalba C.","Gómez, Derlis (57716864100); Romero, Jesús (57716613500); López, Pablo (57716864200); Vázquez, José (57188633638); Cappo, Cristian (55606357600); Pinto, Diego (36970011900); Villalba, Cynthia (57192039478)","57716864100; 57716613500; 57716864200; 57188633638; 55606357600; 36970011900; 57192039478","Cloud architecture for electronic health record systems interoperability","2022","10.3233/THC-212806","https://www.scopus.com/inward/record.uri?eid=2-s2.0-85130873736&doi=10.3233%2fTHC-212806&partnerID=40&md5=646b78c6c1796157bcb994ed3b3548f4"
"","","","STAF-WS 2023 - Post Proceedings of the STAF 2023 Workshops TTC 2023, MeSS 2023 and AgileMDE 2023","2022","","https://www.scopus.com/inward/record.uri?eid=2-s2.0-85183882476&partnerID=40&md5=a54c38c62024aa2b585fb52c24e1bdf9"
"Dolin R.H.; Gothi S.R.; Boxwala A.; Heale B.S.E.; Husami A.; Jones J.; Khangar H.; Londhe S.; Naeymi-Rad F.; Rao S.; Rapchak B.; Shalaby J.; Suraj V.; Xie N.; Chamala S.; Alterovitz G.","Dolin, Robert H. (57196612721); Gothi, Shaileshbhai R. (57222222977); Boxwala, Aziz (6701913960); Heale, Bret S. E. (8918857100); Husami, Ammar (35784501100); Jones, James (57215855571); Khangar, Himanshu (57222228304); Londhe, Shubham (57222229390); Naeymi-Rad, Frank (6603959057); Rao, Soujanya (57222227577); Rapchak, Barbara (8207302000); Shalaby, James (6504618952); Suraj, Varun (57222226116); Xie, Ning (57222229018); Chamala, Srikar (23472194900); Alterovitz, Gil (6505925601)","57196612721; 57222222977; 6701913960; 8918857100; 35784501100; 57215855571; 57222228304; 57222229390; 6603959057; 57222227577; 8207302000; 6504618952; 57222226116; 57222229018; 23472194900; 6505925601","vcf2fhir: a utility to convert VCF files into HL7 FHIR format for genomics-EHR integration","2021","10.1186/s12859-021-04039-1","https://www.scopus.com/inward/record.uri?eid=2-s2.0-85101911007&doi=10.1186%2fs12859-021-04039-1&partnerID=40&md5=cbf05162161055c46e274377d1144993"
"George M.; Chacko A.M.","George, Merlin (57205651836); Chacko, Anu Mary (56040154900)","57205651836; 56040154900","A Patient-Centric Interoperable, Quorum-based Healthcare System for Sharing Clinical Data","2022","10.1109/ICONAT53423.2022.9725924","https://www.scopus.com/inward/record.uri?eid=2-s2.0-85127574045&doi=10.1109%2fICONAT53423.2022.9725924&partnerID=40&md5=f286fd2c64db20a76f98eb44b0a54497"
"de Assis Costa G.; Capistrano Costa I.; Goyal A.","de Assis Costa, Gustavo (56406393400); Capistrano Costa, Inaldo (58172260700); Goyal, Ayush (56888353100)","56406393400; 58172260700; 56888353100","Role of connected objects in healthcare semantic models","2022","10.1016/B978-0-32-391773-5.00010-8","https://www.scopus.com/inward/record.uri?eid=2-s2.0-85151755065&doi=10.1016%2fB978-0-32-391773-5.00010-8&partnerID=40&md5=ff8e64f5815d04a366721b0f33f8f25b"
"Gazzarata R.; Maggi N.; Magnoni L.D.; Monteverde M.E.; Ruggiero C.; Giacomini M.","Gazzarata, Roberta (36466289400); Maggi, Norbert (36724971000); Magnoni, Luca Douglas (57213596940); Monteverde, Maria Eugenia (57213237834); Ruggiero, Carmelina (35561242000); Giacomini, Mauro (55208666200)","36466289400; 36724971000; 57213596940; 57213237834; 35561242000; 55208666200","Semantics Management for a Regional Health Information System in Italy by CTS2 and FHIR","2021","10.3233/SHTI210828","https://www.scopus.com/inward/record.uri?eid=2-s2.0-85120531998&doi=10.3233%2fSHTI210828&partnerID=40&md5=a4f7147544e8b4cfb30c9cd09edc0210"
"Mohamad Y.; Gabber A.; Heidenblut S.; Zenz D.; Siddiqi A.; Gappa H.","Mohamad, Yehya (22433304000); Gabber, Alexander (57706008400); Heidenblut, Sonja (34876876100); Zenz, Daniel (57190251702); Siddiqi, Anam (57705872700); Gappa, Henrike (22333992600)","22433304000; 57706008400; 34876876100; 57190251702; 57705872700; 22333992600","HOW TO OVERCOME LACK OF HEALTH RECORD DATA AND PRIVACY OBSTACLES IN INITIAL PHASES OF MEDICAL DATA ANALYSIS PROJECTS","2022","10.31577/cai_2022_1_233","https://www.scopus.com/inward/record.uri?eid=2-s2.0-85130619002&doi=10.31577%2fcai_2022_1_233&partnerID=40&md5=8f593d5d56fa3b10f6e7847807d63e7b"
"Sfat R.; Marian C.V.","Sfat, Razvan (57271239800); Marian, Constantin Viorel (55583183100)","57271239800; 55583183100","Medical Systems Open Data Exchange Interconnection and Web Questionnaires Based on the HL7 FHIR Standards","2022","10.1109/EHB55594.2022.9991574","https://www.scopus.com/inward/record.uri?eid=2-s2.0-85146604528&doi=10.1109%2fEHB55594.2022.9991574&partnerID=40&md5=61e72e6e418676158022b0d47f9866d1"
"Gokul B.S.","Gokul, B.S. (58153567600)","58153567600","Medical Device Integration for Clinical Decision Support System using SMART on FHIR","2022","10.1109/ICERECT56837.2022.10060121","https://www.scopus.com/inward/record.uri?eid=2-s2.0-85150676706&doi=10.1109%2fICERECT56837.2022.10060121&partnerID=40&md5=1cf956dfacee6a100726778b44a8868f"
"Christlein D.; Kast J.; Baumhauer M.","Christlein, Daniel (57297010800); Kast, Johannes (57296298600); Baumhauer, Matthias (22633858100)","57297010800; 57296298600; 22633858100","Current developments in healthcare information technology: Impact on structured reporting; [Gegenwärtige Entwicklungen in der Healthcare-Informationstechnologie: Auswirkungen auf die strukturierte Befundung]","2021","10.1007/s00117-021-00924-1","https://www.scopus.com/inward/record.uri?eid=2-s2.0-85117132213&doi=10.1007%2fs00117-021-00924-1&partnerID=40&md5=8b08af9c8d14b24baa8f59de38bebb05"
"Auer F.; Abdykalykova Z.; Müller D.; Kramer F.","Auer, Florian (57200856991); Abdykalykova, Zhibek (57557733800); Müller, Dominik (57219584854); Kramer, Frank (55340731000)","57200856991; 57557733800; 57219584854; 55340731000","Adaptation of HL7 FHIR for the Exchange of Patients' Gene Expression Profiles","2022","10.3233/SHTI220730","https://www.scopus.com/inward/record.uri?eid=2-s2.0-85133274176&doi=10.3233%2fSHTI220730&partnerID=40&md5=29738d9b305026ef90792af1d06359ec"
"Van Woensel W.; Abidi S.; Tennankore K.; Worthen G.; Abidi S.S.R.","Van Woensel, William (23052851200); Abidi, Samina (22033756700); Tennankore, Karthik (40462442800); Worthen, George (57220402104); Abidi, Syed Sibte Raza (57223210301)","23052851200; 22033756700; 40462442800; 57220402104; 57223210301","Clinical Guidelines as Executable and Interactive Workflows with FHIR-Compliant Health Data Input Using GLEAN","2022","10.1007/978-3-031-09342-5_43","https://www.scopus.com/inward/record.uri?eid=2-s2.0-85135019202&doi=10.1007%2f978-3-031-09342-5_43&partnerID=40&md5=e215573fb371346c622e3db6bf181132"
"","","","20th International Conference on Practical Applications of Agents and Multi-Agent Systems, PAAMS 2022","2022","","https://www.scopus.com/inward/record.uri?eid=2-s2.0-85141741774&partnerID=40&md5=ab15eb3d8c9fa71cb2fb2f622c843288"
"Schreiber M.; Krauss D.; Blake B.; Boone E.; Almonte R.","Schreiber, Michelle (57197818950); Krauss, Deborah (57325368900); Blake, Bridget (57325333100); Boone, Edna (57325333200); Almonte, Rose (57325333300)","57197818950; 57325368900; 57325333100; 57325333200; 57325333300","Balancing value and burden: The Centers for Medicare & Medicaid Services electronic Clinical Quality Measure (eCQM) Strategy Project","2021","10.1093/jamia/ocab013","https://www.scopus.com/inward/record.uri?eid=2-s2.0-85118598332&doi=10.1093%2fjamia%2focab013&partnerID=40&md5=8b852fe0e8723062231371ecad7d3f3b"
"Zenobia B.","Zenobia, Brent (24476635600)","24476635600","If You Build It, Will They Come? : An Adoption Analysis of the HL7/FHIR/Da Vinci Healthcare Interoperability Stack","2022","10.23919/PICMET53225.2022.9882646","https://www.scopus.com/inward/record.uri?eid=2-s2.0-85139109413&doi=10.23919%2fPICMET53225.2022.9882646&partnerID=40&md5=09fa0783ed29082e04e94ca37eca041a"
"Kilintzis V.; Beredimas N.","Kilintzis, Vassilis (24722814200); Beredimas, Nikolaos (56566722400)","24722814200; 56566722400","Respiratory data management","2022","10.1016/B978-0-12-823447-1.00009-9","https://www.scopus.com/inward/record.uri?eid=2-s2.0-85137609990&doi=10.1016%2fB978-0-12-823447-1.00009-9&partnerID=40&md5=ce7098743aa22a5d530046fca5503f20"
"Ladas N.; Franz S.; Haarbrandt B.; Sommer K.K.; Kohler S.; Ballout S.; Fiebeck J.; Marschollek M.; Gietzelt M.","Ladas, Nektarios (35337386200); Franz, Stefan (57023370700); Haarbrandt, Birger (56002551600); Sommer, Kim Katrin (57208243704); Kohler, Severin (57420042300); Ballout, Sarah (57208243490); Fiebeck, Johanna (57063239200); Marschollek, Michael (22734965900); Gietzelt, Matthias (24831498100)","35337386200; 57023370700; 56002551600; 57208243704; 57420042300; 57208243490; 57063239200; 22734965900; 24831498100","OpenEHR-to-FHIR: Converting openEHR Compositions to Fast Healthcare Interoperability Resources (FHIR) for the German Corona Consensus Dataset (GECCO)","2022","10.3233/SHTI210963","https://www.scopus.com/inward/record.uri?eid=2-s2.0-85123165765&doi=10.3233%2fSHTI210963&partnerID=40&md5=001c1652ddbdf61c99aec9bc4d5bba79"
"Hernandez S.; Fairchild K.; Pemberton M.; Dahmer J.; Zhang W.; Palchuk M.B.; Topaloglu U.","Hernandez, Sean (57315840500); Fairchild, Karen (57813771900); Pemberton, Mark (57813772000); Dahmer, Jonathan (57813758400); Zhang, Wei (57813750100); Palchuk, Matvey B. (15056785100); Topaloglu, Umit (24478069800)","57315840500; 57813771900; 57813772000; 57813758400; 57813750100; 15056785100; 24478069800","Applying FHIR Genomics for Research - From Sequencing to Database","2022","","https://www.scopus.com/inward/record.uri?eid=2-s2.0-85134634562&partnerID=40&md5=8b099ea1ba9b963dcd9b043e514cc3b3"
"Holweg F.; Achenbach S.; Deppenwiese N.; Gaede L.; Prokosch H.-U.","Holweg, Florian (57687658600); Achenbach, Stephan (7005749805); Deppenwiese, Noemi (57210802383); Gaede, Luise (35388197500); Prokosch, Hans-Ulrich (6701859198)","57687658600; 7005749805; 57210802383; 35388197500; 6701859198","Towards a FHIR-Based Data Model for Coronary Angiography Observations","2022","10.3233/SHTI220331","https://www.scopus.com/inward/record.uri?eid=2-s2.0-85130026599&doi=10.3233%2fSHTI220331&partnerID=40&md5=75fa0685d8643ed38330ba8db2da6df2"
"Zhu Y.; Sha Y.; Wu H.; Li M.; Hoffman R.A.; Wang M.D.","Zhu, Yuanda (57211216027); Sha, Ying (56763552300); Wu, Hang (57037188100); Li, Mai (57221150063); Hoffman, Ryan A. (56457297700); Wang, May D. (10739831700)","57211216027; 56763552300; 57037188100; 57221150063; 56457297700; 10739831700","Proposing Causal Sequence of Death by Neural Machine Translation in Public Health Informatics","2022","10.1109/JBHI.2022.3163013","https://www.scopus.com/inward/record.uri?eid=2-s2.0-85127498393&doi=10.1109%2fJBHI.2022.3163013&partnerID=40&md5=d83018fa536978d37e0101922b7e19ba"
"Randmaa R.; Bossenko I.; Klementi T.; Piho G.; Ross P.","Randmaa, Rainer (57976265100); Bossenko, Igor (57951337000); Klementi, Toomas (57977000100); Piho, Gunnar (36497203700); Ross, Peeter (15760838900)","57976265100; 57951337000; 57977000100; 36497203700; 15760838900","Evaluating business meta-models for semantic interoperability with FHIR resources","2022","","https://www.scopus.com/inward/record.uri?eid=2-s2.0-85142447401&partnerID=40&md5=aca338c490fe75febf7829853066c24d"
"Milosevic Z.; Pyefinch F.","Milosevic, Zoran (56370870500); Pyefinch, Frank (57940449800)","56370870500; 57940449800","Computable Consent – From Regulatory, Legislative, and Organizational Policies to Security Policies","2022","10.1007/978-3-031-17604-3_1","https://www.scopus.com/inward/record.uri?eid=2-s2.0-85140480168&doi=10.1007%2f978-3-031-17604-3_1&partnerID=40&md5=6aa8f6a0dd0f66f44ff80c4d3c04c9c7"
"Agnew J.; Helland P.; Cole A.","Agnew, James (57223621835); Helland, Pat (6603053747); Cole, Adam (57789614900)","57223621835; 6603053747; 57789614900","FHIR: Reducing Friction in the Exchange of Healthcare Data","2022","10.1145/3534861","https://www.scopus.com/inward/record.uri?eid=2-s2.0-85133662285&doi=10.1145%2f3534861&partnerID=40&md5=c006b1c005540f7ed308c4bf5c4dffe6"
"Rosenau L.; Majeed R.W.; Ingenerf J.; Kiel A.; Kroll B.; Köhler T.; Prokosch H.-U.; Gruendner J.","Rosenau, Lorenz (57670055400); Majeed, Raphael W. (54417750200); Ingenerf, Josef (6603276740); Kiel, Alexander (55604636100); Kroll, Björn (57212802522); Köhler, Thomas (57670658500); Prokosch, Hans-Ulrich (6701859198); Gruendner, Julian (57208246806)","57670055400; 54417750200; 6603276740; 55604636100; 57212802522; 57670658500; 6701859198; 57208246806","Generation of a Fast Healthcare Interoperability Resources (FHIR)-based Ontology for Federated Feasibility Queries in the Context of COVID-19: Feasibility Study","2022","10.2196/35789","https://www.scopus.com/inward/record.uri?eid=2-s2.0-85129634300&doi=10.2196%2f35789&partnerID=40&md5=ba2bc35b4c60eec89a19187d72680153"
"Richter J.G.; Chehab G.; Schwartz C.; Ricken E.; Tomczak M.; Acar H.; Gappa H.; Velasco C.A.; Rosengren P.; Povilionis A.; Schneider M.; Thestrup J.","Richter, Jutta G. (55772850500); Chehab, Gamal (6602452297); Schwartz, Catarina (57224114951); Ricken, Elisabeth (57224111792); Tomczak, Monika (58424657900); Acar, Hasan (55836386900); Gappa, Henrike (22333992600); Velasco, Carlos A. (57202808525); Rosengren, Peter (35194620200); Povilionis, Armanas (57189044765); Schneider, Matthias (7404064148); Thestrup, Jesper (22982034000)","55772850500; 6602452297; 57224114951; 57224111792; 58424657900; 55836386900; 22333992600; 57202808525; 35194620200; 57189044765; 7404064148; 22982034000","The PICASO cloud platform for improved holistic care in rheumatoid arthritis treatment—experiences of patients and clinicians","2021","10.1186/s13075-021-02526-7","https://www.scopus.com/inward/record.uri?eid=2-s2.0-85106993679&doi=10.1186%2fs13075-021-02526-7&partnerID=40&md5=6c4981a05f219e312ed2d87beac06854"
"Lemus-Zúñiga L.-G.; Félix J.M.; Fides-Valero A.; Benlloch-Dualde J.-V.; Martinez-Millana A.","Lemus-Zúñiga, Lenin-Guillermo (55859637700); Félix, Juan M. (57458667700); Fides-Valero, Alvaro (25928209000); Benlloch-Dualde, José-Vte (24721097200); Martinez-Millana, Antonio (49964119000)","55859637700; 57458667700; 25928209000; 24721097200; 49964119000","A Proof-of-Concept IoT System for Remote Healthcare Based on Interoperability Standards","2022","10.3390/s22041646","https://www.scopus.com/inward/record.uri?eid=2-s2.0-85124886512&doi=10.3390%2fs22041646&partnerID=40&md5=9b3c06f72a6343118fe01d66ae7c87f3"
"Bossenko I.; Piho G.; Ross P.","Bossenko, Igor (57951337000); Piho, Gunnar (36497203700); Ross, Peeter (15760838900)","57951337000; 36497203700; 15760838900","Forward and backward compatibility design techniques applying the HL7 FHIR standard","2022","","https://www.scopus.com/inward/record.uri?eid=2-s2.0-85142411868&partnerID=40&md5=db1931ddcbeef2223ffe4ac68c822e3e"
"Lee H.-A.; Hsu C.-Y.","Lee, Hsiu-An (57202740385); Hsu, Chien-Yeh (55752327900)","57202740385; 55752327900","An Architecture of Real-World Data Database","2022","10.1007/978-981-19-4132-0_19","https://www.scopus.com/inward/record.uri?eid=2-s2.0-85141659496&doi=10.1007%2f978-981-19-4132-0_19&partnerID=40&md5=d3252159619ae2c2407c079eeadc88d3"
"Van Woensel W.; Abidi S.; Tennankore K.; Worthen G.; Abidi S.S.R.","Van Woensel, William (23052851200); Abidi, Samina (22033756700); Tennankore, Karthik (40462442800); Worthen, George (57220402104); Abidi, Syed Sibte Raza (57223210301)","23052851200; 22033756700; 40462442800; 57220402104; 57223210301","Explainable Decision Support Using Task Network Models in Notation3: Computerizing Lipid Management Clinical Guidelines as Interactive Task Networks","2022","10.1007/978-3-031-09342-5_1","https://www.scopus.com/inward/record.uri?eid=2-s2.0-85135028026&doi=10.1007%2f978-3-031-09342-5_1&partnerID=40&md5=6461a7d12315a253f779c8dae30ec007"
"Umberfield E.E.; Staes C.J.; Morgan T.P.; Grout R.W.; Mamlin B.W.; Dixon B.E.","Umberfield, Elizabeth E. (57203005763); Staes, Catherine J. (6603222234); Morgan, Teryn P. (58243502800); Grout, Randall W. (57210685080); Mamlin, Burke W. (6603111372); Dixon, Brian E. (57213322290)","57203005763; 6603222234; 58243502800; 57210685080; 6603111372; 57213322290","Syntactic interoperability and the role of syntactic standards in health information exchange","2022","10.1016/B978-0-323-90802-3.00004-6","https://www.scopus.com/inward/record.uri?eid=2-s2.0-85158938506&doi=10.1016%2fB978-0-323-90802-3.00004-6&partnerID=40&md5=42716334a9fec3c1bf6f0b3815d2c717"
"Kaur J.; Kaur J.; Dhama A.S.; Jindal S.; Walia K.; Singh H.","Kaur, Jasleen (57203775061); Kaur, Jasmine (57204289189); Dhama, Ajay Singh (57204068544); Jindal, Shelja (57606426400); Walia, Kamini (6506512140); Singh, Harpreet (57210460215)","57203775061; 57204289189; 57204068544; 57606426400; 6506512140; 57210460215","Strengthening the Surveillance of Antimicrobial Resistance in India Using Integrative Technologies","2022","10.3389/fpubh.2022.861888","https://www.scopus.com/inward/record.uri?eid=2-s2.0-85128620734&doi=10.3389%2ffpubh.2022.861888&partnerID=40&md5=008c69bb6128b44c79cdf231371450e2"
"Khatiwada P.; Yang B.; Skjelvik A.","Khatiwada, Pankaj (57219791117); Yang, Bian (7404472502); Skjelvik, Alvhild (57952859900)","57219791117; 7404472502; 57952859900","Reference design model for a patient-centric data exchange healthcare environment","2022","10.1109/IHSH57076.2022.10092114","https://www.scopus.com/inward/record.uri?eid=2-s2.0-85154614648&doi=10.1109%2fIHSH57076.2022.10092114&partnerID=40&md5=d1e0adc0bb2ce7071222c57ff593af7a"
"Michaels M.; Syed S.; Lober W.B.","Michaels, Maria (57215140840); Syed, Sameemuddin (57373714600); Lober, William B. (6602948011)","57215140840; 57373714600; 6602948011","Blueprint for aligned data exchange for research and public health","2021","10.1093/jamia/ocab210","https://www.scopus.com/inward/record.uri?eid=2-s2.0-85121263759&doi=10.1093%2fjamia%2focab210&partnerID=40&md5=c46594337241f8bcc6cf8354f5652a7c"
"","","","9th Latin American High Performance Computing Conference, CARLA 2022","2022","","https://www.scopus.com/inward/record.uri?eid=2-s2.0-85146717672&partnerID=40&md5=66f4ac5f774b2b287742d615214b9390"
"","","","HEDA 2022 - Proceedings of the International Health Data Workshop, co-located with 10th International Conference on Petrinets, Petri Nets 2022","2022","","https://www.scopus.com/inward/record.uri?eid=2-s2.0-85142411457&partnerID=40&md5=f125859e56ab86aa834f3c1185ff1e0c"
"Khurshid A.; Oliveira E.; Nordquist E.; Lakshminarayanan V.; Abrol V.","Khurshid, Anjum (32867798300); Oliveira, Eliel (57968113400); Nordquist, Eric (57897788900); Lakshminarayanan, Vidya (57968273000); Abrol, Vishal (57742596700)","32867798300; 57968113400; 57897788900; 57968273000; 57742596700","FHIRedApp: A LEAP in health information technology for promoting patient access to their medical information","2021","10.1093/jamiaopen/ooab109","https://www.scopus.com/inward/record.uri?eid=2-s2.0-85142056213&doi=10.1093%2fjamiaopen%2fooab109&partnerID=40&md5=897c0183ecca41ed22759b2db3f1d3ae"
"Alvarez-Romero C.; Martínez-García A.; Sinaci A.A.; Gencturk M.; Méndez E.; Hernández-Pérez T.; Liperoti R.; Angioletti C.; Löbe M.; Ganapathy N.; Deserno T.M.; Almada M.; Costa E.; Chronaki C.; Cangioli G.; Cornet R.; Poblador-Plou B.; Carmona-Pírez J.; Gimeno-Miguel A.; Poncel-Falcó A.; Prados-Torres A.; Kovacevic T.; Zaric B.; Bokan D.; Hromis S.; Djekic Malbasa J.; Rapallo Fernández C.; Velázquez Fernández T.; Rochat J.; Gaudet-Blavignac C.; Lovis C.; Weber P.; Quintero M.; Perez-Perez M.M.; Ashley K.; Horton L.; Parra Calderón C.L.","Alvarez-Romero, Celia (57210788267); Martínez-García, Alicia (55937333600); Sinaci, A. Anil (36905158800); Gencturk, Mert (53063547700); Méndez, Eva (36855954900); Hernández-Pérez, Tony (35213151400); Liperoti, Rosa (9940135200); Angioletti, Carmen (57205739691); Löbe, Matthias (55938448500); Ganapathy, Nagarajan (58296234200); Deserno, Thomas M. (21233724300); Almada, Marta (51160963300); Costa, Elisio (7402527214); Chronaki, Catherine (6701349152); Cangioli, Giorgio (56690472900); Cornet, Ronald (57201825238); Poblador-Plou, Beatriz (35622277100); Carmona-Pírez, Jonás (57202163168); Gimeno-Miguel, Antonio (57201724319); Poncel-Falcó, Antonio (55043233700); Prados-Torres, Alexandra (57200124667); Kovacevic, Tomi (56205406300); Zaric, Bojan (16403676100); Bokan, Darijo (57195593453); Hromis, Sanja (32867618500); Djekic Malbasa, Jelena (57208734534); Rapallo Fernández, Carlos (57966699800); Velázquez Fernández, Teresa (57966863000); Rochat, Jessica (57194129754); Gaudet-Blavignac, Christophe (57090883300); Lovis, Christian (55046580400); Weber, Patrick (58346835700); Quintero, Miriam (57776231400); Perez-Perez, Manuel M. (57217672051); Ashley, Kevin (55761240700); Horton, Laurence (57967213100); Parra Calderón, Carlos Luis (24332533000)","57210788267; 55937333600; 36905158800; 53063547700; 36855954900; 35213151400; 9940135200; 57205739691; 55938448500; 58296234200; 21233724300; 51160963300; 7402527214; 6701349152; 56690472900; 57201825238; 35622277100; 57202163168; 57201724319; 55043233700; 57200124667; 56205406300; 16403676100; 57195593453; 32867618500; 57208734534; 57966699800; 57966863000; 57194129754; 57090883300; 55046580400; 58346835700; 57776231400; 57217672051; 55761240700; 57967213100; 24332533000","FAIR4Health: Findable, Accessible, Interoperable and Reusable data to foster Health Research","2022","10.12688/openreseurope.14349.2","https://www.scopus.com/inward/record.uri?eid=2-s2.0-85133820721&doi=10.12688%2fopenreseurope.14349.2&partnerID=40&md5=343a1ac3f128dbfd3c01fdebeca500a6"
"Vijayaraghavan M.; Masson L.; Kannry J.","Vijayaraghavan, Mahima (57282203100); Masson, Lisa (57219513553); Kannry, Joseph (6506309507)","57282203100; 57219513553; 6506309507","Clinical Decision Support: It’s More than Just Alerts","2022","10.1007/978-3-030-93765-2_7","https://www.scopus.com/inward/record.uri?eid=2-s2.0-85173424237&doi=10.1007%2f978-3-030-93765-2_7&partnerID=40&md5=f9bc8ec271e4ce3b380fde6280f6e76a"
"Mohammed S.; Fiaidhi J.; Sawyer D.","Mohammed, Sabah (57206398228); Fiaidhi, Jinan (57207503753); Sawyer, Darien (57275272800)","57206398228; 57207503753; 57275272800","Prototyping the Problem Oriented Medical Record for Connected Health Based on TypeGraphQL","2022","10.1109/BigData55660.2022.10020388","https://www.scopus.com/inward/record.uri?eid=2-s2.0-85147961087&doi=10.1109%2fBigData55660.2022.10020388&partnerID=40&md5=03c8397f687bb5e8653aac17a192fc83"
"Ciampi M.; Sicuranza M.; Silvestri S.","Ciampi, Mario (23396134400); Sicuranza, Mario (55441642700); Silvestri, Stefano (56450341200)","23396134400; 55441642700; 56450341200","A Privacy-Preserving and Standard-Based Architecture for Secondary Use of Clinical Data","2022","10.3390/info13020087","https://www.scopus.com/inward/record.uri?eid=2-s2.0-85124809239&doi=10.3390%2finfo13020087&partnerID=40&md5=88b5e25f7cbf6f136ac2343b023f8abd"
