"Authors","Author full names","Author(s) ID","Title","Year","DOI","Link"
"Braunstein M.L.","Braunstein, Mark L. (57200585260)","57200585260","Health Care in the Age of Interoperability Part 5: The Personal Health Record","2019","10.1109/MPULS.2019.2911804","https://www.scopus.com/inward/record.uri?eid=2-s2.0-85066869516&doi=10.1109%2fMPULS.2019.2911804&partnerID=40&md5=55baa8c269895787adc073701bf1cb0c"
"Cunningham P.M.; Cunningham M.","Cunningham, Paul M (56640715000); Cunningham, Miriam (56640600400)","56640715000; 56640600400","MHealth4Afrika -Co-Designing a Standards based Solution for Use in Resource Constrained Primary Healthcare Facilities","2019","10.1109/EMBC.2019.8856860","https://www.scopus.com/inward/record.uri?eid=2-s2.0-85077769326&doi=10.1109%2fEMBC.2019.8856860&partnerID=40&md5=7829fb4eefc329531be6e5e51e388a41"
"Hong N.; Wen A.; Shen F.; Sohn S.; Wang C.; Liu H.; Jiang G.","Hong, Na (56982540500); Wen, Andrew (57203248254); Shen, Feichen (55813011500); Sohn, Sunghwan (7101646425); Wang, Chen (55682602500); Liu, Hongfang (7409753328); Jiang, Guoqian (55486706700)","56982540500; 57203248254; 55813011500; 7101646425; 55682602500; 7409753328; 55486706700","Developing a scalable FHIR-based clinical data normalization pipeline for standardizing and integrating unstructured and structured electronic health record data","2019","10.1093/jamiaopen/ooz056","https://www.scopus.com/inward/record.uri?eid=2-s2.0-85087152285&doi=10.1093%2fjamiaopen%2fooz056&partnerID=40&md5=0831af256db041a9b7e0232d1caa86bf"
"Gruendner J.; Schwachhofer T.; Sippl P.; Wolf N.; Erpenbeck M.; Gulden C.; Kapsner L.A.; Zierk J.; Mate S.; Stürzl M.; Croner R.; Prokosch H.-U.; Toddenroth D.","Gruendner, Julian (57208246806); Schwachhofer, Thorsten (57211156084); Sippl, Phillip (57211160692); Wolf, Nicolas (57211155787); Erpenbeck, Marcel (57211160588); Gulden, Christian (57189691606); Kapsner, Lorenz A. (57206905177); Zierk, Jakob (55825439000); Mate, Sebastian (54581374100); Stürzl, Michael (56264851100); Croner, Roland (6507695519); Prokosch, Hans-Ulrich (6701859198); Toddenroth, Dennis (36599445900)","57208246806; 57211156084; 57211160692; 57211155787; 57211160588; 57189691606; 57206905177; 55825439000; 54581374100; 56264851100; 6507695519; 6701859198; 36599445900","Ketos: Clinical decision support and machine learning as a service – A training and deployment platform based on Docker, OMOP-CDM, and FHIR Web Services","2019","10.1371/journal.pone.0223010","https://www.scopus.com/inward/record.uri?eid=2-s2.0-85072842677&doi=10.1371%2fjournal.pone.0223010&partnerID=40&md5=d69c8f8f99e4d949859ebe6ab202e124"
"Braunstein M.L.; Oancea I.; Barry B.K.; Darlington S.; Steel J.; Hansen D.P.; Battock J.; Cheung D.; Gan G.; Hooper B.; Lundin R.; Nicol D.; O'Brien J.; Whittington S.; Wilkinson C.; Wong T.T.","Braunstein, Mark L. (57200585260); Oancea, Iulia (49461664600); Barry, Benjamin K. (7202401891); Darlington, Sharon (57222706166); Steel, Jim (8528983500); Hansen, David P. (7202786760); Battock, James (57222706196); Cheung, Daniel (57222706198); Gan, Gregory (57222706163); Hooper, Ben (57222706106); Lundin, Reilly (57222706151); Nicol, Duncan (59024284400); O'Brien, Joshua (57222706127); Whittington, Scott (57222706190); Wilkinson, Chris (57222706189); Wong, Tse Tse (57222706099)","57200585260; 49461664600; 7202401891; 57222706166; 8528983500; 7202786760; 57222706196; 57222706198; 57222706163; 57222706106; 57222706151; 59024284400; 57222706127; 57222706190; 57222706189; 57222706099","The development and electronic delivery of case-based learning using a fast healthcare interoperability resource system","2019","10.1093/jamiaopen/ooz055","https://www.scopus.com/inward/record.uri?eid=2-s2.0-85103742844&doi=10.1093%2fjamiaopen%2fooz055&partnerID=40&md5=42fb66fad2643084fc282c1312e8fb49"
"Saripalle R.","Saripalle, Rishi (36618198500)","36618198500","Representing UMLS knowledge using FHIR Terminological Resources","2019","10.1109/BIBM47256.2019.8983305","https://www.scopus.com/inward/record.uri?eid=2-s2.0-85084341600&doi=10.1109%2fBIBM47256.2019.8983305&partnerID=40&md5=ade907c581569fc10b66682eefd7bd3d"
"McClure R.C.; Macumber C.L.; Skapik J.L.; Smith A.M.","McClure, Robert C. (8423779000); Macumber, Caroline L. (57213264090); Skapik, Julia L. (57213271131); Smith, Anne Marie (57213267393)","8423779000; 57213264090; 57213271131; 57213267393","Igniting Harmonized Digital Clinical Quality Measurement through Terminology, CQL, and FHIR","2020","10.1055/s-0039-3402755","https://www.scopus.com/inward/record.uri?eid=2-s2.0-85077753386&doi=10.1055%2fs-0039-3402755&partnerID=40&md5=37d0fa3d807bcf10ae588586a8103a7e"
"Choudhury A.; van Soest J.; Nayak S.; Dekker A.","Choudhury, Ananya (57204176548); van Soest, Johan (56156330000); Nayak, Stuti (57202891410); Dekker, Andre (57225379184)","57204176548; 56156330000; 57202891410; 57225379184","Personal Health Train on FHIR: A Privacy Preserving Federated Approach for Analyzing FAIR Data in Healthcare","2020","10.1007/978-981-15-6315-7_7","https://www.scopus.com/inward/record.uri?eid=2-s2.0-85088209201&doi=10.1007%2f978-981-15-6315-7_7&partnerID=40&md5=cdae641f0e41c04c2f88a90267ff66ef"
"Lenivtceva I.; Slasten E.; Kashina M.; Kopanitsa G.","Lenivtceva, Iuliia (57216567381); Slasten, Evgenia (57217480924); Kashina, Mariya (57217479821); Kopanitsa, Georgy (55326019500)","57216567381; 57217480924; 57217479821; 55326019500","Applicability of machine learning methods to multi-label medical text classification","2020","10.1007/978-3-030-50423-6_38","https://www.scopus.com/inward/record.uri?eid=2-s2.0-85087277664&doi=10.1007%2f978-3-030-50423-6_38&partnerID=40&md5=da3dacb14fefb3a3857c7b75a04ae24d"
"Tahar K.; Müller C.; Dürschmid A.; Haferkamp S.; Saleh K.; Jürs P.; Stäubert S.; Gewehr J.E.; Zenker S.; Ammon D.; Wendt T.","Tahar, Kais (57191667213); Müller, Christoph (7404110366); Dürschmid, Andreas (57210796107); Haferkamp, Silke (57204332717); Saleh, Kutaiba (56903802800); Jürs, Patrick (57210791980); Stäubert, Sebastian (36648060200); Gewehr, Jan Erik (57204313295); Zenker, Sven (23053628800); Ammon, Danny (55394417700); Wendt, Thomas (55952473400)","57191667213; 7404110366; 57210796107; 57204332717; 56903802800; 57210791980; 36648060200; 57204313295; 23053628800; 55394417700; 55952473400","Integrating heterogeneous data sources for cross-institutional data sharing: Requirements elicitation and management in Smith","2019","10.3233/SHTI190647","https://www.scopus.com/inward/record.uri?eid=2-s2.0-85071508283&doi=10.3233%2fSHTI190647&partnerID=40&md5=51491da535cccbd53911f33efe9d7eba"
"Hong N.; Wang K.; Wu S.; Shen F.; Yao L.; Jiang G.","Hong, Na (56982540500); Wang, Kui (57196236322); Wu, Sizhu (59614426700); Shen, Feichen (55813011500); Yao, Lixia (53868570800); Jiang, Guoqian (55486706700)","56982540500; 57196236322; 59614426700; 55813011500; 53868570800; 55486706700","An Interactive Visualization Tool for HL7 FHIR Specification Browsing and Profiling","2019","10.1007/s41666-018-0043-8","https://www.scopus.com/inward/record.uri?eid=2-s2.0-85088166791&doi=10.1007%2fs41666-018-0043-8&partnerID=40&md5=d0926e645ef703c6747973df586542e6"
"Sanchez-Doria M.; Gayo J.E.L.; Fernandez-Alvarez D.; Garcia-Gonzalez H.","Sanchez-Doria, Maria (57210572131); Gayo, Jose Emilio Labra (57210586493); Fernandez-Alvarez, Daniel (57195755037); Garcia-Gonzalez, Herminio (57201323363)","57210572131; 57210586493; 57195755037; 57201323363","Testing the usability of SNOMED CT terms suggestion in medical report","2019","10.1109/CBMS.2019.00137","https://www.scopus.com/inward/record.uri?eid=2-s2.0-85071045402&doi=10.1109%2fCBMS.2019.00137&partnerID=40&md5=3ccb61cbbbaf13225b7b158da4a8d20d"
"Carter G.; Chevellereau B.; Shahriar H.; Sneha S.","Carter, Gracie (57211112662); Chevellereau, Benjamin (58568860500); Shahriar, Hossain (23096391900); Sneha, Sweta (13613845300)","57211112662; 58568860500; 23096391900; 13613845300","OpenPharma Blockchain on FHIR: An Interoperable Solution for Read-Only Health Records Exchange through Blockchain and Biometrics","2020","10.30953/bhty.v3.120","https://www.scopus.com/inward/record.uri?eid=2-s2.0-85117584591&doi=10.30953%2fbhty.v3.120&partnerID=40&md5=f5ce8dbd10056ee28920cc0edac2a573"
"Hawig D.; Zhou C.; Fuhrhop S.; Fialho A.S.; Ramachandran N.","Hawig, David (57209571006); Zhou, Chao (57209568815); Fuhrhop, Sebastian (57209576021); Fialho, Andre S. (57209567818); Ramachandran, Navin (8833101600)","57209571006; 57209568815; 57209576021; 57209567818; 8833101600","Designing a distributed ledger technology system for interoperable and general data protection regulation–compliant health data exchange: A use case in blood glucose data","2019","10.2196/13665","https://www.scopus.com/inward/record.uri?eid=2-s2.0-85068152886&doi=10.2196%2f13665&partnerID=40&md5=4f494dbb5ef3b10d495bc185474a2be6"
"Deppenwiese N.; Duhm-Harbeck P.; Ingenerf J.; Ulrich H.","Deppenwiese, Noemi (57210802383); Duhm-Harbeck, Petra (57194134090); Ingenerf, Josef (6603276740); Ulrich, Hannes (56347799300)","57210802383; 57194134090; 6603276740; 56347799300","MDrcupid: A configurable metadata matching toolbox","2019","10.3233/SHTI190189","https://www.scopus.com/inward/record.uri?eid=2-s2.0-85071504135&doi=10.3233%2fSHTI190189&partnerID=40&md5=8d304966dd29e43abe55d93fecc82661"
"Oemig F.","Oemig, Frank (22941217500)","22941217500","HL7 version 2.x goes fhir","2019","10.3233/SHTI190811","https://www.scopus.com/inward/record.uri?eid=2-s2.0-85071780314&doi=10.3233%2fSHTI190811&partnerID=40&md5=ce7e1e6eddc9a33eec33e5c0b95f72d2"
"Gomes F.; Freitas R.; Ribeiro M.; Moura C.; Andrade O.; Oliveira M.","Gomes, Fabio (57205027474); Freitas, Renato (57197819486); Ribeiro, Morgana (57215859881); Moura, Csar (57205020581); Andrade, Odorico (50461391200); Oliveira, Mauro (55913082200)","57205027474; 57197819486; 57215859881; 57205020581; 50461391200; 55913082200","GIRLS, a Gateway for Interoperability of electronic health Record in Low-cost System : ∗ Interoperability beetween FHIR and OpenEHR Standards","2019","10.1109/HealthCom46333.2019.9009602","https://www.scopus.com/inward/record.uri?eid=2-s2.0-85082134626&doi=10.1109%2fHealthCom46333.2019.9009602&partnerID=40&md5=143c2edd033ec5f30076d498794e2de7"
"Eapen B.R.; Archer N.; Sartipi K.; Yuan Y.","Eapen, Bell Raj (55946642900); Archer, Norm (7006158219); Sartipi, Kamran (6602396284); Yuan, Yufei (7402708857)","55946642900; 7006158219; 6602396284; 7402708857","Drishti: A sense-plan-act extension to open mHealth framework using FHIR","2019","10.1109/SEH.2019.00016","https://www.scopus.com/inward/record.uri?eid=2-s2.0-85072916555&doi=10.1109%2fSEH.2019.00016&partnerID=40&md5=4a9b175ac3728edb246fe8f5631a7dfc"
"Fette G.; Kaspar M.; Liman L.; Ertl M.; Krebs J.; Dietrich G.; Störk S.; Puppe F.","Fette, Georg (13105452300); Kaspar, Mathias (56184886900); Liman, Leon (57201944603); Ertl, Maximilian (55599512900); Krebs, Jonathan (57195719547); Dietrich, Georg (56287841100); Störk, Stefan (6603842450); Puppe, Frank (6602110405)","13105452300; 56184886900; 57201944603; 55599512900; 57195719547; 56287841100; 6603842450; 6602110405","Query translation between AQL and CQL","2019","10.3233/SHTI190197","https://www.scopus.com/inward/record.uri?eid=2-s2.0-85071515261&doi=10.3233%2fSHTI190197&partnerID=40&md5=f934ac16eb57ae0b193e04592306e612"
"Mallia A.J.","Mallia, Anthony J. (57880847300)","57880847300","A next generation of IT: A health record example with terminology binding","2019","10.4018/978-1-7998-1204-3.ch103","https://www.scopus.com/inward/record.uri?eid=2-s2.0-85137602150&doi=10.4018%2f978-1-7998-1204-3.ch103&partnerID=40&md5=ce21d284fb8d66600b25211492b4f957"
"Osterman T.J.; Terry M.; Miller R.S.","Osterman, Travis J. (6701499406); Terry, May, Msc (57219769296); Miller, Robert S. (55547118821)","6701499406; 57219769296; 55547118821","Improving cancer data interoperability: The promise of the minimal common oncology data elements (mCODE) initiative","2020","10.1200/CCI.20.00059","https://www.scopus.com/inward/record.uri?eid=2-s2.0-85095404946&doi=10.1200%2fCCI.20.00059&partnerID=40&md5=4047b07e841a5a9a5799d77aa07420e9"
"Aranha H.; Masi M.; Pavleska T.; Sellitto G.P.","Aranha, Helder (57205668128); Masi, Massimiliano (35208825700); Pavleska, Tanja (57191439597); Sellitto, Giovanni Paolo (57211999443)","57205668128; 35208825700; 57191439597; 57211999443","Securing Mobile e-Health Environments by Design: A Holistic Architectural Approach","2019","10.1109/WiMOB.2019.8923479","https://www.scopus.com/inward/record.uri?eid=2-s2.0-85077598332&doi=10.1109%2fWiMOB.2019.8923479&partnerID=40&md5=4a3a73d720ddd25fdf1342bbd01fd9a6"
"Houta S.; Ameler T.; Surges R.","Houta, Salima (56790112200); Ameler, Tim (57213149627); Surges, Rainer (57203921777)","56790112200; 57213149627; 57203921777","Use of HL7 FHIR to structure data in epilepsy self-management applications","2019","10.1109/WiMOB.2019.8923179","https://www.scopus.com/inward/record.uri?eid=2-s2.0-85077552138&doi=10.1109%2fWiMOB.2019.8923179&partnerID=40&md5=fe07b71a6221c0ac7c491cf924ee1d4a"
"Petrakis Y.; Kouroubali A.; Katehakis D.","Petrakis, Yannis (8652570800); Kouroubali, Angelina (13003899300); Katehakis, Dimitrios (6603615029)","8652570800; 13003899300; 6603615029","A Mobile App Architecture for Accessing EMRs Using XDS and FHIR","2019","10.1109/BIBE.2019.00057","https://www.scopus.com/inward/record.uri?eid=2-s2.0-85078574773&doi=10.1109%2fBIBE.2019.00057&partnerID=40&md5=1eb4324918f6ad5f5addcf190781306e"
"Jenders R.A.","Jenders, Robert A. (6701711590)","6701711590","Evaluation of the fast healthcare interoperability resources (FHIR) standard for representation of knowledge bases encoded in the Arden syntax","2019","10.3233/SHTI190600","https://www.scopus.com/inward/record.uri?eid=2-s2.0-85071414475&doi=10.3233%2fSHTI190600&partnerID=40&md5=6cde0e141453e4027e0b06c7990a00ee"
"Lee S.Y.","Lee, Sang Young (35187351500)","35187351500","A fast healthcare interoperability resources based blockchain framework for medical data management","2020","10.33168/JSMS.2020.0408","https://www.scopus.com/inward/record.uri?eid=2-s2.0-85097833437&doi=10.33168%2fJSMS.2020.0408&partnerID=40&md5=8bd3516e0208103df1eeb6e19f5a364a"
"Dullabh P.; Hovey L.; Heaney-Huls K.; Rajendran N.; Wright A.; Sittig D.F.","Dullabh, Prashila (35299185600); Hovey, Lauren (53263782800); Heaney-Huls, Krysta (57210640227); Rajendran, Nithya (57210642190); Wright, Adam (16644142900); Sittig, Dean F. (35254375300)","35299185600; 53263782800; 57210640227; 57210642190; 16644142900; 35254375300","Application Programming Interfaces in Health Care: Findings from a Current-State Sociotechnical Assessmen","2020","10.1055/s-0039-1701001","https://www.scopus.com/inward/record.uri?eid=2-s2.0-85078224172&doi=10.1055%2fs-0039-1701001&partnerID=40&md5=6a7cb428ffdd1bfbe70313b09b370464"
"Hwa Jung J.; Kyu Choi D.; In Kim J.; Joo Koh S.","Hwa Jung, Joong (57194055389); Kyu Choi, Dong (57194053880); In Kim, Ji (25927175300); Joo Koh, Seok (8958394800)","57194055389; 57194053880; 25927175300; 8958394800","Mobility management for healthcare services in coap-based iot networks","2019","10.1109/ICOIN.2019.8718156","https://www.scopus.com/inward/record.uri?eid=2-s2.0-85066747985&doi=10.1109%2fICOIN.2019.8718156&partnerID=40&md5=3f747808488bb9406612c8f8c3e0195d"
"Persons K.R.; Nagels J.; Carr C.; Mendelson D.S.; Primo H.R.; Fischer B.; Doyle M.","Persons, Kenneth R. (7003842845); Nagels, Jason (56376263500); Carr, Chris (7202449282); Mendelson, David S. (7005934757); Primo, Henri “Rik” (6508312068); Fischer, Bernd (57214602424); Doyle, Matthew (57190006948)","7003842845; 56376263500; 7202449282; 7005934757; 6508312068; 57214602424; 57190006948","Interoperability and Considerations for Standards-Based Exchange of Medical Images: HIMSS-SIIM Collaborative White Paper","2020","10.1007/s10278-019-00294-0","https://www.scopus.com/inward/record.uri?eid=2-s2.0-85076201791&doi=10.1007%2fs10278-019-00294-0&partnerID=40&md5=88dd021a37ee53a2301f47ad0dae8609"
"Garza M.Y.; Rutherford M.; Myneni S.; Fenton S.; Walden A.; Topaloglu U.; Eisenstein E.; Kumar K.R.; Zimmerman K.O.; Rocca M.; Gordon G.S.; Hume S.; Wang Z.; Zozus M.","Garza, Maryam Y. (57192102881); Rutherford, Michael (57216407155); Myneni, Sahiti (35097608700); Fenton, Susan (17343232900); Walden, Anita (16308434500); Topaloglu, Umit (24478069800); Eisenstein, Eric (7005737383); Kumar, Karan R. (57097496200); Zimmerman, Kanecia O. (56001965300); Rocca, Mitra (36868077200); Gordon, Gideon Scott (57217259589); Hume, Sam (57214625318); Wang, Zhan (57205722766); Zozus, Meredith (56744770800)","57192102881; 57216407155; 35097608700; 17343232900; 16308434500; 24478069800; 7005737383; 57097496200; 56001965300; 36868077200; 57217259589; 57214625318; 57205722766; 56744770800","Evaluating the Coverage of the HL7 ® FHIR ® Standard to Support eSource Data Exchange Implementations for use in Multi-Site Clinical Research Studies","2020","","https://www.scopus.com/inward/record.uri?eid=2-s2.0-85087768530&partnerID=40&md5=a74aa17ff9e9976d99c7f31ead276182"
"Kiourtis A.; Mavrogiorgou A.; Vidakis K.; Kyriazis D.","Kiourtis, Athanasios (57190855747); Mavrogiorgou, Argyro (57190857284); Vidakis, Konstantinos (57217586952); Kyriazis, Dimosthenis (16301182100)","57190855747; 57190857284; 57217586952; 16301182100","Health record index: Secure access of cloud-tored healthcare data","2020","10.3233/SHTI200534","https://www.scopus.com/inward/record.uri?eid=2-s2.0-85087414333&doi=10.3233%2fSHTI200534&partnerID=40&md5=926f87e4e03bfe0b8e32819ad17fed47"
"McGlinn K.; Hussey P.","McGlinn, Kris (22938154900); Hussey, Pamela (56913085700)","22938154900; 56913085700","An analysis of demographic data in irish healthcare domain to support semantic uplift","2020","10.1007/978-3-030-50423-6_34","https://www.scopus.com/inward/record.uri?eid=2-s2.0-85087283179&doi=10.1007%2f978-3-030-50423-6_34&partnerID=40&md5=fbc684cab95a32bcd13b26d11b3ffe2f"
"Roca S.; Hernández M.; Sancho J.; García J.; Alesanco Á.","Roca, Surya (57203360407); Hernández, Manuel (55628402000); Sancho, Jorge (57194699352); García, José (57199441222); Alesanco, Álvaro (6506167803)","57203360407; 55628402000; 57194699352; 57199441222; 6506167803","Virtual Assistant Prototype for Managing Medication Using Messaging Platforms","2020","10.1007/978-3-030-31635-8_116","https://www.scopus.com/inward/record.uri?eid=2-s2.0-85075907243&doi=10.1007%2f978-3-030-31635-8_116&partnerID=40&md5=3ea328168b128af7792b064f210cbf96"
"Kiourtis A.; Nifakos S.; Mavrogiorgou A.; Kyriazis D.","Kiourtis, Athanasios (57190855747); Nifakos, Sokratis (56600901300); Mavrogiorgou, Argyro (57190857284); Kyriazis, Dimosthenis (16301182100)","57190855747; 56600901300; 57190857284; 16301182100","Aggregating the syntactic and semantic similarity of healthcare data towards their transformation to HL7 FHIR through ontology matching","2019","10.1016/j.ijmedinf.2019.104002","https://www.scopus.com/inward/record.uri?eid=2-s2.0-85073208195&doi=10.1016%2fj.ijmedinf.2019.104002&partnerID=40&md5=5b2dcbab0fc0f5e9f81cb0ac0cc246b8"
"Poncet L.; Panjo H.; Andro A.; Ringa V.","Poncet, Lorraine (57210579871); Panjo, Henri (44561477700); Andro, Armelle (8853145500); Ringa, Virginie (6701542492)","57210579871; 44561477700; 8853145500; 6701542492","Caesarean delivery in a migration context: the role of prior delivery in the host country","2020","10.1080/26410397.2020.1763576","https://www.scopus.com/inward/record.uri?eid=2-s2.0-85086685848&doi=10.1080%2f26410397.2020.1763576&partnerID=40&md5=b4118296d55aedbccfc0aa0d2054d557"
"Rubin L.; López N.P.; Gaiera A.; Campos F.; Luna D.; De Quirós F.B.G.","Rubin, Luciana (57200255354); López, Natalia Pérez (57210793942); Gaiera, Alejandro (57200254316); Campos, Fernando (37025723900); Luna, Daniel (8437483000); De Quirós, Fernán Bernaldo González (8437483100)","57200255354; 57210793942; 57200254316; 37025723900; 8437483000; 8437483100","Development, implementation and preliminary results of an electronic reminder for HIV screening using a service oriented architecture","2019","10.3233/SHTI190326","https://www.scopus.com/inward/record.uri?eid=2-s2.0-85071421708&doi=10.3233%2fSHTI190326&partnerID=40&md5=6e8ea17e5ce076fae17df89ef7eb69ae"
"Kubick W.","Kubick, Wayne (7801680874)","7801680874","Data standards as a pathway to interoperability","2020","10.1016/B978-0-12-824490-6.00003-7","https://www.scopus.com/inward/record.uri?eid=2-s2.0-85126411311&doi=10.1016%2fB978-0-12-824490-6.00003-7&partnerID=40&md5=0071c63839cb8e9fbd59d9c73c73f5bc"
"Metke-Jimenez A.; Harrap K.; Conlan D.; Gibson S.; Pearson J.; Hansen D.","Metke-Jimenez, Alejandro (36782756000); Harrap, Karen (24376136400); Conlan, David (24528417500); Gibson, Simon (54794091600); Pearson, John (9237952400); Hansen, David (7202786760)","36782756000; 24376136400; 24528417500; 54794091600; 9237952400; 7202786760","A smart on FHIR prototype for genomic test ordering","2019","10.3233/SHTI190783","https://www.scopus.com/inward/record.uri?eid=2-s2.0-85071001406&doi=10.3233%2fSHTI190783&partnerID=40&md5=cf46294771ae155c2abe9645e9cbe3e2"
"Demurjian S.; Agresta T.; Sanzi E.; DeStefano J.","Demurjian, Steven (6603876241); Agresta, Thomas (12806542300); Sanzi, Eugene (57113566500); DeStefano, John (57224175354)","6603876241; 12806542300; 57113566500; 57224175354","Alternative approaches for supporting Lattice-based Access Control (LBAC) in the Fast Healthcare Interoperability Resources (FHIR) standard","2020","","https://www.scopus.com/inward/record.uri?eid=2-s2.0-85107137835&partnerID=40&md5=81326c8e7656a945a51326084c0f857d"
"Rivera Sánchez Y.K.; Demurjian S.A.; Baihan M.S.","Rivera Sánchez, Yaira K. (56593037000); Demurjian, Steven A. (6603876241); Baihan, Mohammed S. (56705584800)","56593037000; 6603876241; 56705584800","A service-based RBAC & MAC approach incorporated into the FHIR standard","2019","10.1016/j.dcan.2019.10.004","https://www.scopus.com/inward/record.uri?eid=2-s2.0-85075485179&doi=10.1016%2fj.dcan.2019.10.004&partnerID=40&md5=1bcf37af3c81e63a73b8807e915ed473"
"Tanaka K.; Yamamoto R.","Tanaka, Katsuya (55624472393); Yamamoto, Ryuichi (35415682600)","55624472393; 35415682600","Implementation of a secured cross-institutional data collection infrastructure by applying HL7 FHIR on an existing distributed EMR storages","2020","10.3233/SHTI200517","https://www.scopus.com/inward/record.uri?eid=2-s2.0-85087418881&doi=10.3233%2fSHTI200517&partnerID=40&md5=67fbad409fa4c98ccdf5a25738d08da5"
"Won K.J.; Lee A.R.; Lee E.; Kim I.K.","Won, Kyung Jae (57216703520); Lee, Ah Ra (57207456585); Lee, Eunjoo (56502620400); Kim, Il Kon (14919454400)","57216703520; 57207456585; 56502620400; 14919454400","Fast Healthcare Interoperability Resources Profiling of Korea Frailty and Aging Cohort Study Questionnaire","2019","10.1109/BIBM47256.2019.8983284","https://www.scopus.com/inward/record.uri?eid=2-s2.0-85084329437&doi=10.1109%2fBIBM47256.2019.8983284&partnerID=40&md5=1cee3cfc4d1ad497c1bd4b5154ab2173"
"Zhang X.A.; Yates A.; Vasilevsky N.; Gourdine J.P.; Callahan T.J.; Carmody L.C.; Danis D.; Joachimiak M.P.; Ravanmehr V.; Pfaff E.R.; Champion J.; Robasky K.; Xu H.; Fecho K.; Walton N.A.; Zhu R.L.; Ramsdill J.; Mungall C.J.; Köhler S.; Haendel M.A.; McDonald C.J.; Vreeman D.J.; Peden D.B.; Bennett T.D.; Feinstein J.A.; Martin B.; Stefanski A.L.; Hunter L.E.; Chute C.G.; Robinson P.N.","Zhang, Xingmin Aaron (57216166717); Yates, Amy (57204393840); Vasilevsky, Nicole (40361488700); Gourdine, J.P. (57190607482); Callahan, Tiffany J. (57192690777); Carmody, Leigh C. (6603002819); Danis, Daniel (57209446724); Joachimiak, Marcin P. (6508039734); Ravanmehr, Vida (24544876600); Pfaff, Emily R. (55922283700); Champion, James (57211055711); Robasky, Kimberly (37666023900); Xu, Hao (55493938900); Fecho, Karamarie (6602119784); Walton, Nephi A. (57207105246); Zhu, Richard L. (57211715891); Ramsdill, Justin (57204392383); Mungall, Christopher J. (6602880619); Köhler, Sebastian (23980415100); Haendel, Melissa A. (6602819027); McDonald, Clement J. (7401519782); Vreeman, Daniel J. (12779832900); Peden, David B. (7006115492); Bennett, Tellen D. (7202878300); Feinstein, James A. (12773642100); Martin, Blake (57191985678); Stefanski, Adrianne L. (55773148200); Hunter, Lawrence E. (57689685500); Chute, Christopher G. (7006581202); Robinson, Peter N. (7403719646)","57216166717; 57204393840; 40361488700; 57190607482; 57192690777; 6603002819; 57209446724; 6508039734; 24544876600; 55922283700; 57211055711; 37666023900; 55493938900; 6602119784; 57207105246; 57211715891; 57204392383; 6602880619; 23980415100; 6602819027; 7401519782; 12779832900; 7006115492; 7202878300; 12773642100; 57191985678; 55773148200; 57689685500; 7006581202; 7403719646","Semantic integration of clinical laboratory tests from electronic health records for deep phenotyping and biomarker discovery","2019","10.1038/s41746-019-0110-4","https://www.scopus.com/inward/record.uri?eid=2-s2.0-85089606359&doi=10.1038%2fs41746-019-0110-4&partnerID=40&md5=edb7f7cd9674a23dc6009ccff11dc467"
"Solbrig H.R.; Prud'hommeaux E.; Booth D.; Endle C.M.; Stone D.J.; Jiang G.","Solbrig, Harold R. (36945944400); Prud'hommeaux, Eric (55978154500); Booth, David (57196803611); Endle, Cory M. (55806403500); Stone, Daniel J. (57211270553); Jiang, Guoqian (55486706700)","36945944400; 55978154500; 57196803611; 55806403500; 57211270553; 55486706700","Exploring JSON-LD as an Executable Definition of FHIR RDF to Enable","2020","","https://www.scopus.com/inward/record.uri?eid=2-s2.0-85105351571&partnerID=40&md5=2f1b6d30c3acf2c02b86e96f710dc259"
