"Authors","Author full names","Author(s) ID","Title","Year","DOI","Link"
"Csarmann A.; Zeckl J.; Haug P.; Jenders R.A.; Rappelsberger A.; Adlassnig K.-P.","Csarmann, Andreas (58477604000); Zeckl, Julia (57194343697); Haug, Peter (24480894300); Jenders, Robert A. (6701711590); Rappelsberger, Andrea (22035949700); Adlassnig, Klaus-Peter (7003385915)","58477604000; 57194343697; 24480894300; 6701711590; 22035949700; 7003385915","Arden Syntax on FHIR","2023","10.3233/SHTI230521","https://www.scopus.com/inward/record.uri?eid=2-s2.0-85164233221&doi=10.3233%2fSHTI230521&partnerID=40&md5=771b8eb7b0b2a2fef39ae39b1bcb1541"
"Moniz K.; Ashford P.","Moniz, K. (57221966174); Ashford, P. (16548862300)","57221966174; 16548862300","P-IT-3 | Communicating Information on Blood and Cell Products in HL7 FHIR Electronic Messages","2023","10.1111/trf.267_17554","https://www.scopus.com/inward/record.uri?eid=2-s2.0-85174175956&doi=10.1111%2ftrf.267_17554&partnerID=40&md5=e45e8c2a19b96ddef050686e6eac5f89"
"Latorre F.; Hawks C.E.; Colmenares B.; Verma D.; Gil M.; Sala N.","Latorre, Fernando (58477602400); Hawks, Claudia E. (57188881102); Colmenares, Bruno (58477640600); Verma, Deepika (57210705968); Gil, Marisa (58477796900); Sala, Nuria (58477755300)","58477602400; 57188881102; 58477640600; 57210705968; 58477796900; 58477755300","Interoperable Universal Resource Identifier for Selective Disclosure of Data","2023","10.3233/SHTI230465","https://www.scopus.com/inward/record.uri?eid=2-s2.0-85164231289&doi=10.3233%2fSHTI230465&partnerID=40&md5=4876cb5aed136e18e219bddc885c8d85"
"Cheng A.C.; Dunkel L.; Byrne L.M.; Tischbein M.; Burts D.; Hamilton J.; Phillips K.; Embry B.; Tan J.; Olson E.; Harris P.A.","Cheng, Alex C. (57195465115); Dunkel, Leah (57224499841); Byrne, Loretta M. (7004068620); Tischbein, Maeve (56491286800); Burts, Delicia (58676928700); Hamilton, Jahi (57218443519); Phillips, Kaysi (57466015300); Embry, Bryce (58676928800); Tan, Jason (57222601154); Olson, Erik (57466160100); Harris, Paul A. (7403636133)","57195465115; 57224499841; 7004068620; 56491286800; 58676928700; 57218443519; 57466015300; 58676928800; 57222601154; 57466160100; 7403636133","ResearchMatch on FHIR: Development and evaluation of a recruitment registry and electronic health record system interface for volunteer profile completion","2023","10.1017/cts.2023.654","https://www.scopus.com/inward/record.uri?eid=2-s2.0-85175557424&doi=10.1017%2fcts.2023.654&partnerID=40&md5=711d4080903bf68fee9b882371980e7e"
"Das S.; Hussey P.","Das, Subhashis (57202838768); Hussey, Pamela (56913085700)","57202838768; 56913085700","HL7-FHIR-Based ContSys Formal Ontology for Enabling Continuity of Care Data Interoperability","2023","10.3390/jpm13071024","https://www.scopus.com/inward/record.uri?eid=2-s2.0-85166293371&doi=10.3390%2fjpm13071024&partnerID=40&md5=5ece109188d939fc4ac7318aafc9b70a"
"Raso E.; Loreti P.; Ravaziol M.; Bracciale L.","Raso, Emanuele (57216288655); Loreti, Pierpaolo (7003459349); Ravaziol, Michele (58965602700); Bracciale, Lorenzo (24722537100)","57216288655; 7003459349; 58965602700; 24722537100","Anonymization and Pseudonymization of FHIR Resources for Secondary Use of Healthcare Data","2024","10.1109/ACCESS.2024.3381034","https://www.scopus.com/inward/record.uri?eid=2-s2.0-85189151440&doi=10.1109%2fACCESS.2024.3381034&partnerID=40&md5=27e11a03c604c3689d8a341be41a1fa0"
"Gabrielle P.-H.; Mehta H.; Barthelmes D.; Daien V.; Nguyen V.; Gillies M.C.; Creuzot-Garcher C.P.","Gabrielle, Pierre-Henry (57194323368); Mehta, Hemal (36806518600); Barthelmes, Daniel (12797735000); Daien, Vincent (26644758000); Nguyen, Vuong (56970423000); Gillies, Mark C. (7006152251); Creuzot-Garcher, Catherine P. (6701311678)","57194323368; 36806518600; 12797735000; 26644758000; 56970423000; 7006152251; 6701311678","From randomised controlled trials to real-world data: Clinical evidence to guide management of diabetic macular oedema","2023","10.1016/j.preteyeres.2023.101219","https://www.scopus.com/inward/record.uri?eid=2-s2.0-85175583497&doi=10.1016%2fj.preteyeres.2023.101219&partnerID=40&md5=2d1333619a675307ed8026d6758660a2"
"Jacobsson M.; Seoane F.; Abtahi F.","Jacobsson, Martin (13608873400); Seoane, Fernando (8535281700); Abtahi, Farhad (55516314400)","13608873400; 8535281700; 55516314400","The role of compression in large scale data transfer and storage of typical biomedical signals at hospitals","2023","10.1177/14604582231213846","https://www.scopus.com/inward/record.uri?eid=2-s2.0-85179305751&doi=10.1177%2f14604582231213846&partnerID=40&md5=1e10ed7a53159fb7148f050fbac7ffb7"
"Dolin R.; Heale B.S.E.; Gupta R.; Alvarez C.; Aronson J.; Boxwala A.; Gothi S.R.; Husami A.; Shalaby J.; Babb L.; Wagner A.; Chamala S.","Dolin, Robert (57196612721); Heale, Bret S. E. (8918857100); Gupta, Rohan (58105403600); Alvarez, Carla (58558696100); Aronson, Justin (58105335100); Boxwala, Aziz (6701913960); Gothi, Shaileshbhai R. (57222222977); Husami, Ammar (35784501100); Shalaby, James (6504618952); Babb, Lawrence (53871037400); Wagner, Alex (55049381800); Chamala, Srikar (23472194900)","57196612721; 8918857100; 58105403600; 58558696100; 58105335100; 6701913960; 57222222977; 35784501100; 6504618952; 53871037400; 55049381800; 23472194900","Sync for Genes Phase 5: Computable artifacts for sharing dynamically annotated FHIR-formatted genomic variants","2023","10.1002/lrh2.10385","https://www.scopus.com/inward/record.uri?eid=2-s2.0-85169415067&doi=10.1002%2flrh2.10385&partnerID=40&md5=4fda601dc0f285c6c9446313e05b5454"
"Chirila O.S.; Avram D.; Szilagyi M.M.; Chirila C.-B.; Stoicu-Tivadar L.","Chirila, Oana Sorina (57238667300); Avram, Denis (59301878000); Szilagyi, Mihaela Monica (59301964800); Chirila, Ciprian-Bogdan (27067559900); Stoicu-Tivadar, Lăcrămioara (23499695100)","57238667300; 59301878000; 59301964800; 27067559900; 23499695100","Enhancing Patient Care: Achieving Interoperability between General Practitioners' and Stomatologists' information systems using FHIR standard and Firebase cloud","2024","10.1109/SACI60582.2024.10619795","https://www.scopus.com/inward/record.uri?eid=2-s2.0-85202341044&doi=10.1109%2fSACI60582.2024.10619795&partnerID=40&md5=46f9ee9dcfcc0bc85e54d0fd38cb9a7f"
"Sninsky J.A.; Toups J.V.; Cotton C.C.; Peery A.F.; Arora S.","Sninsky, Jared A. (57211122298); Toups, J. Vincent (58866762800); Cotton, Cary C. (55255726200); Peery, Anne F. (35722864000); Arora, Shifali (57191429371)","57211122298; 58866762800; 55255726200; 35722864000; 57191429371","An Electronic Medical Record Prediction Model to Identify Inadequate Bowel Preparation in Patients at Outpatient Colonoscopy","2024","10.1016/j.tige.2023.12.008","https://www.scopus.com/inward/record.uri?eid=2-s2.0-85184173030&doi=10.1016%2fj.tige.2023.12.008&partnerID=40&md5=e1c7ed42d633e7616af949d809b33872"
"Hosch R.; Baldini G.; Parmar V.; Borys K.; Koitka S.; Engelke M.; Arzideh K.; Ulrich M.; Nensa F.","Hosch, René (57218207808); Baldini, Giulia (57831232500); Parmar, Vicky (57364034500); Borys, Katarzyna (58160048100); Koitka, Sven (57193347638); Engelke, Merlin (58176697700); Arzideh, Kamyar (58475900700); Ulrich, Moritz (58476361900); Nensa, Felix (55611423600)","57218207808; 57831232500; 57364034500; 58160048100; 57193347638; 58176697700; 58475900700; 58476361900; 55611423600","FHIR-PYrate: a data science friendly Python package to query FHIR servers","2023","10.1186/s12913-023-09498-1","https://www.scopus.com/inward/record.uri?eid=2-s2.0-85164140108&doi=10.1186%2fs12913-023-09498-1&partnerID=40&md5=572fa6bfef734d2e324cec6a7e664ee9"
"Heine L.; Hörst F.; Nasca E.; Egger J.; Siveke J.T.; Kim M.; Kleesiek J.; Bahnsen F.H.","Heine, Lukas (58644938700); Hörst, Fabian (57946707600); Nasca, Enrico (57421695900); Egger, Jan (23388906400); Siveke, Jens T. (6603072868); Kim, Moon (58100656000); Kleesiek, Jens (9743752700); Bahnsen, Fin H. (55760445600)","58644938700; 57946707600; 57421695900; 23388906400; 6603072868; 58100656000; 9743752700; 55760445600","Lean Study Host: Towards an Automated Pipeline for Multi-Center Study Hosting","2024","","https://www.scopus.com/inward/record.uri?eid=2-s2.0-85199780105&partnerID=40&md5=3d88b141fb3a7b514adb98cc1d9e9754"
"","","","5th International Conference on Biomedical and Health Informatics, ICBHI 2022","2024","","https://www.scopus.com/inward/record.uri?eid=2-s2.0-85193620682&partnerID=40&md5=36c356b87dd93fa0a32d9921a4c3c806"
"Mohammed S.; Fiaidhi J.","Mohammed, Sabah (57206398228); Fiaidhi, Jinan (57207503753)","57206398228; 57207503753","Establishment of a mindmap for medical e-Diagnosis as a service for graph-based learning and analytics","2023","10.1007/s00521-021-06200-6","https://www.scopus.com/inward/record.uri?eid=2-s2.0-85115145282&doi=10.1007%2fs00521-021-06200-6&partnerID=40&md5=44248d668ec085a5bb05bce06f7cf195"
"Ayaz M.; Pasha M.F.; Alahmadi T.J.; Abdullah N.N.B.; Alkahtani H.K.","Ayaz, Muhammad (57222957928); Pasha, Muhammad Fermi (9738067600); Alahmadi, Tahani Jaser (57195584064); Abdullah, Nik Nailah Binti (23090482500); Alkahtani, Hend Khalid (57226796110)","57222957928; 9738067600; 57195584064; 23090482500; 57226796110","Transforming Healthcare Analytics with FHIR: A Framework for Standardizing and Analyzing Clinical Data","2023","10.3390/healthcare11121729","https://www.scopus.com/inward/record.uri?eid=2-s2.0-85163736632&doi=10.3390%2fhealthcare11121729&partnerID=40&md5=65ec08fc630b7963305bfff147b9c265"
"Malaquias R.S.; Filho I.D.M.B.; Lima J.M.M.D.; Gurgel A.M.; Brito B.A.O.D.","Malaquias, Ramon Santos (57209879957); Filho, Itamir de Morais Barroca (58108614000); Lima, Jean Mário Moreira de (59250832700); Gurgel, André Morais (54948714800); Brito, Bruna Alice Oliveira de (59251032300)","57209879957; 58108614000; 59250832700; 54948714800; 59251032300","MiSIS: An HL7 FHIR Middleware for Healthcare Information Systems","2024","10.1007/978-3-031-64608-9_16","https://www.scopus.com/inward/record.uri?eid=2-s2.0-85200690961&doi=10.1007%2f978-3-031-64608-9_16&partnerID=40&md5=12fe56d0c55c90c6a94667dd948f5a8f"
"Pournik O.; Ahmad B.; Lim Choi Keung S.N.; Peake A.; Rafid S.; Tong C.; Laleci Erturkmen G.B.; Gencturk M.; Akpinar A.E.; Arvanitis T.N.","Pournik, Omid (25655405800); Ahmad, Bilal (57777604300); Lim Choi Keung, Sarah N. (55165391600); Peake, Ashley (57777160100); Rafid, Shadman (57208244699); Tong, Chao (58477537600); Laleci Erturkmen, Gokce B. (57484670100); Gencturk, Mert (53063547700); Akpinar, A. Emre (58264445400); Arvanitis, Theodoros N. (6701910707)","25655405800; 57777604300; 55165391600; 57777160100; 57208244699; 58477537600; 57484670100; 53063547700; 58264445400; 6701910707","Interoperable E-Health System Using Structural and Semantic Interoperability Approaches in CAREPATH","2023","10.3233/SHTI230571","https://www.scopus.com/inward/record.uri?eid=2-s2.0-85164231633&doi=10.3233%2fSHTI230571&partnerID=40&md5=1de86e0155e4b1e089d48e4574ea33f5"
"Tetzlaff L.; Purohit A.-M.; Spallek J.; Holmberg C.; Schrader T.","Tetzlaff, Laura (55734507300); Purohit, Anne-Maria (57195714819); Spallek, Jacob (24282091200); Holmberg, Christine (23485497600); Schrader, Thomas (7005775811)","55734507300; 57195714819; 24282091200; 23485497600; 7005775811","Evaluating Interoperability in German Critical Incident Reporting Systems","2023","10.3233/SHTI230722","https://www.scopus.com/inward/record.uri?eid=2-s2.0-85170631222&doi=10.3233%2fSHTI230722&partnerID=40&md5=536741371b528a52ef47a249ed626c51"
"Agroti L.; Canciu I.-C.; Christodoulou M.; Papaioannou M.; Neocleous A.; Savva P.; Yiasemi C.; Solomou T.; Panayides A.; Antoniou Z.; Neofytou M.; Constantinou I.; Pattichis C.S.","Agroti, Louiza (58477801400); Canciu, Ionut-Cristian (58477685100); Christodoulou, Marios (58477685200); Papaioannou, Maria (36632895100); Neocleous, Andreas (10840117700); Savva, Panayiotis (57406263100); Yiasemi, Constantinos (58477801500); Solomou, Theodoros (57674397800); Panayides, Andreas (16646871500); Antoniou, Zinonas (35753139200); Neofytou, Marios (16175812500); Constantinou, Ioannis (35752779100); Pattichis, Constantinos S. (35495139000)","58477801400; 58477685100; 58477685200; 36632895100; 10840117700; 57406263100; 58477801500; 57674397800; 16646871500; 35753139200; 16175812500; 35752779100; 35495139000","MYeHealthAppCY: A Healthcare Mobile Application in Cyprus","2023","10.3233/SHTI230491","https://www.scopus.com/inward/record.uri?eid=2-s2.0-85164230028&doi=10.3233%2fSHTI230491&partnerID=40&md5=4b3abf741f2853ab4a0ab74fff84fe66"
"Ziegler J.; Gruendner J.; Rosenau L.; Erpenbeck M.; Prokosch H.-U.; Deppenwiese N.","Ziegler, Jasmin (58572114500); Gruendner, Julian (57208246806); Rosenau, Lorenz (57670055400); Erpenbeck, Marcel (57211160588); Prokosch, Hans-Ulrich (6701859198); Deppenwiese, Noemi (57210802383)","58572114500; 57208246806; 57670055400; 57211160588; 6701859198; 57210802383","Towards a Bavarian Oncology Real World Data Research Platform","2023","10.3233/SHTI230696","https://www.scopus.com/inward/record.uri?eid=2-s2.0-85170627645&doi=10.3233%2fSHTI230696&partnerID=40&md5=8b8b0853a63f8305dc4482e7b45c743b"
"Niţulescu A.; Crişan-Vida M.; Stoicu-Tivadar L.","Niţulescu, Adina (56728574400); Crişan-Vida, Mihaela (36195820000); Stoicu-Tivadar, Lâcrâmioara (23499695100)","56728574400; 36195820000; 23499695100","Towards FAIR Data Standardization Using FHIR Genomics Resources Integration in Obstetrics-Gynecology Department Systems","2023","10.3233/SHTI230460","https://www.scopus.com/inward/record.uri?eid=2-s2.0-85164230941&doi=10.3233%2fSHTI230460&partnerID=40&md5=937e5bdbd11d8a7932ab84974b706737"
"Liu T.-J.; Lee H.-T.; Wu F.","Liu, Tz-Jie (58569351500); Lee, Hsu-Ting (58569025000); Wu, Fan (55700771600)","58569351500; 58569025000; 55700771600","Building an Electronic Medical Record System Exchanged in FHIR Format and Its Visual Presentation","2023","10.3390/healthcare11172410","https://www.scopus.com/inward/record.uri?eid=2-s2.0-85170365721&doi=10.3390%2fhealthcare11172410&partnerID=40&md5=2ef75e5575c9c23352c512badba08df5"
"Latorre F.; Hawks C.E.; Bahillo E.; Gil M.; Colmenares B.; Verma D.; Sala N.","Latorre, Fernando (58477602400); Hawks, Claudia E. (57188881102); Bahillo, Esther (58477602500); Gil, Marisa (58477796900); Colmenares, Bruno (58477640600); Verma, Deepika (57210705968); Sala, Nuria (58477755300)","58477602400; 57188881102; 58477602500; 58477796900; 58477640600; 57210705968; 58477755300","Quality and Traceability of Starting Materials from Supplier to Recipient","2023","10.3233/SHTI230559","https://www.scopus.com/inward/record.uri?eid=2-s2.0-85164230308&doi=10.3233%2fSHTI230559&partnerID=40&md5=bfdec719e4e621964ffd15e25136f92e"
"Buendía-García F.; Ferrandis M.L.","Buendía-García, Félix (16229321500); Ferrandis, Meritxell Leal (58236605800)","16229321500; 58236605800","Understanding the Role of Standard Educational Specifications and Interoperable Resources When Designing and Developing Digital Learning Interventions in Nursing Simulation Scenarios","2024","10.1007/978-3-031-53963-3_1","https://www.scopus.com/inward/record.uri?eid=2-s2.0-85189309228&doi=10.1007%2f978-3-031-53963-3_1&partnerID=40&md5=1153a17fd2aed98be789bd1739243701"
"Munjal N.K.; Clark R.S.B.; Simon D.W.; Kochanek P.M.; Horvat C.M.","Munjal, Neil K. (57193888588); Clark, Robert S. B. (35400165300); Simon, Dennis W. (55989184500); Kochanek, Patrick M. (7102257013); Horvat, Christopher M. (56565364600)","57193888588; 35400165300; 55989184500; 7102257013; 56565364600","Interoperable and explainable machine learning models to predict morbidity and mortality in acute neurological injury in the pediatric intensive care unit: secondary analysis of the TOPICC study","2023","10.3389/fped.2023.1177470","https://www.scopus.com/inward/record.uri?eid=2-s2.0-85164933739&doi=10.3389%2ffped.2023.1177470&partnerID=40&md5=9fedb22fa6c2f2239b544a562dcc9c6b"
"Heudel P.; Crochet H.; Durand T.; Zrounba P.; Blay J.-Y.","Heudel, Pierre (23993520200); Crochet, Hugo (57221942692); Durand, Thierry (19639962800); Zrounba, Philippe (8858820800); Blay, Jean-Yves (7103116204)","23993520200; 57221942692; 19639962800; 8858820800; 7103116204","From data strategy to implementation to advance cancer research and cancer care: A French comprehensive cancer center experience","2023","10.1371/journal.pdig.0000415","https://www.scopus.com/inward/record.uri?eid=2-s2.0-85201675957&doi=10.1371%2fjournal.pdig.0000415&partnerID=40&md5=22d30e02ffa6a65064cd8cfe7b573cc2"
"Boufahja A.; Pujadas P.; Raba A.; Mishra N.","Boufahja, Abderrazek (56203522500); Pujadas, Pilar (57223188442); Raba, Adam (58209480300); Mishra, Namrata (58209050500)","56203522500; 57223188442; 58209480300; 58209050500","A vendor-neutral business analytics and quality measurement system for radiation dose index monitoring","2023","10.1016/j.health.2023.100252","https://www.scopus.com/inward/record.uri?eid=2-s2.0-85171872443&doi=10.1016%2fj.health.2023.100252&partnerID=40&md5=e46e7e5151ff83054e65579b129f6b12"
"Soares A.; Schilling L.M.; Richardson J.; Kommadi B.; Subbian V.; Dehnbostel J.; Shahin K.; Robinson K.A.; Afzal M.; Lehmann H.P.; Kunnamo I.; Alper B.S.","Soares, Andrey (57221855269); Schilling, Lisa M. (7005555253); Richardson, Joshua (35300450600); Kommadi, Bhagvan (57220089349); Subbian, Vignesh (55346447500); Dehnbostel, Joanne (37033693100); Shahin, Khalid (57221843800); Robinson, Karen A. (7403229142); Afzal, Muhammad (7102789390); Lehmann, Harold P. (7402884460); Kunnamo, Ilkka (6604091280); Alper, Brian S. (7005178673)","57221855269; 7005555253; 35300450600; 57220089349; 55346447500; 37033693100; 57221843800; 7403229142; 7102789390; 7402884460; 6604091280; 7005178673","Making Science Computable Using Evidence-Based Medicine on Fast Healthcare Interoperability Resources: Standards Development Project","2024","10.2196/54265","https://www.scopus.com/inward/record.uri?eid=2-s2.0-85197008157&doi=10.2196%2f54265&partnerID=40&md5=a5846821def32ff9e63e03c0846e9883"
"Barros M.V.; Martina J.E.","Barros, Maurício de Vasconcelos (57476142700); Martina, Jean Everson (23135153100)","57476142700; 23135153100","SovereignRx: An Electronic Prescription System Based on High Privacy, Blockchain, and Self-Sovereign Identity","2024","10.1007/978-3-031-57916-5_32","https://www.scopus.com/inward/record.uri?eid=2-s2.0-85191229857&doi=10.1007%2f978-3-031-57916-5_32&partnerID=40&md5=cd7d8a62c4e8cdee8120f8a7a5b6ecbf"
"Perugu B.; Wadhwa V.; Kim J.; Cai J.; Shin A.; Gupta A.","Perugu, Bharath (58516832800); Wadhwa, Varun (58517045700); Kim, Jin (58516832900); Cai, Jenny (58517151400); Shin, Audrey (58516728000); Gupta, Amar (8451638300)","58516832800; 58517045700; 58516832900; 58517151400; 58516728000; 8451638300","Pragmatic Approaches to Interoperability in the U.S.: Surmounting Barriers to Healthcare Data and Information Across Organizations","2023","10.30953/thmt.v8.421","https://www.scopus.com/inward/record.uri?eid=2-s2.0-85166397443&doi=10.30953%2fthmt.v8.421&partnerID=40&md5=3ee9941244c2b9b692930a1c0ba71f7e"
"Oehm J.B.; Riepenhausen S.L.; Storck M.; Dugas M.; Pryss R.; Varghese J.","Oehm, Johannes Benedict (57217245076); Riepenhausen, Sarah Luise (57208239638); Storck, Michael (56427743100); Dugas, Martin (55550317000); Pryss, Rüdiger (36142027900); Varghese, Julian (56485357200)","57217245076; 57208239638; 56427743100; 55550317000; 36142027900; 56485357200","Integration of Patient-Reported Outcome Data Collected Via Web Applications and Mobile Apps Into a Nation-Wide COVID-19 Research Platform Using Fast Healthcare Interoperability Resources: Development Study","2024","10.2196/47846","https://www.scopus.com/inward/record.uri?eid=2-s2.0-85186576915&doi=10.2196%2f47846&partnerID=40&md5=002c1f4d70a31dc89afa92789df5ad44"
"Monsen K.A.; Heermann L.; Dunn-Lopez K.","Monsen, Karen A. (57220399299); Heermann, Laura (6602690312); Dunn-Lopez, Karen (57221793808)","57220399299; 6602690312; 57221793808","FHIR-up! Advancing knowledge from clinical data through application of standardized nursing terminologies within HL7VR FHIRVR","2023","10.1093/jamia/ocad131","https://www.scopus.com/inward/record.uri?eid=2-s2.0-85174641978&doi=10.1093%2fjamia%2focad131&partnerID=40&md5=fcc4dfb97fdd914340d16eeaefab063e"
"Mack S.J.; Sauter J.; Robinson J.; Osoegawa K.; McKenzie L.; Schneider J.; Maiers M.; Milius R.P.","Mack, Steven J. (7006007713); Sauter, Jürgen (55855796400); Robinson, James (57198433717); Osoegawa, Kazutoyo (7004066110); McKenzie, Lloyd (58480457000); Schneider, Joel (56849759000); Maiers, Martin (6602070144); Milius, Robert P. (56923631800)","7006007713; 55855796400; 57198433717; 7004066110; 58480457000; 56849759000; 6602070144; 56923631800","The genotype list string code syntax for exchanging nomenclature-level genotyping results in clinical and research data management and analysis systems","2023","10.1111/tan.15145","https://www.scopus.com/inward/record.uri?eid=2-s2.0-85164360098&doi=10.1111%2ftan.15145&partnerID=40&md5=7ff6a65f3114fb7ca4d494f230701421"
"Beckmann C.L.; Keuchel D.; Soleman W.O.I.A.; Nürnberg S.; Böckmann B.","Beckmann, Catharina Lena (57878453400); Keuchel, Daniel (57224206738); Soleman, Wa Ode Iin Arliani (58778359800); Nürnberg, Sylvia (55514858800); Böckmann, Britta (55642187900)","57878453400; 57224206738; 58778359800; 55514858800; 55642187900","Semantic Integration of BPMN Models and FHIR Data to Enable Personalized Decision Support for Malignant Melanoma","2023","10.3390/info14120649","https://www.scopus.com/inward/record.uri?eid=2-s2.0-85180552557&doi=10.3390%2finfo14120649&partnerID=40&md5=65e3c7ade992e3550b08a0ab5c400309"
"Schladetzky J.; Kock-Schoppenhauer A.-K.; Drenkhahn C.; Ingenerf J.; Wiedekopf J.","Schladetzky, Jan (58572116900); Kock-Schoppenhauer, Ann-Kristin (57194129811); Drenkhahn, Cora (57210795019); Ingenerf, Josef (6603276740); Wiedekopf, Joshua (57224206347)","58572116900; 57194129811; 57210795019; 6603276740; 57224206347","Mettertron - Bridging Metadata Repositories and Terminology Servers","2023","10.3233/SHTI230721","https://www.scopus.com/inward/record.uri?eid=2-s2.0-85170627810&doi=10.3233%2fSHTI230721&partnerID=40&md5=4c930dfb8f1b5a79716a6374f66cc29e"
"Latorre F.; Hawks C.E.; Colmenares B.; Verma D.; Gil M.; Sala N.","Latorre, Fernando (58477602400); Hawks, Claudia E. (57188881102); Colmenares, Bruno (58477640600); Verma, Deepika (57210705968); Gil, Marisa (58477796900); Sala, Nuria (58477755300)","58477602400; 57188881102; 58477640600; 57210705968; 58477796900; 58477755300","Patient-Centric Interoperability and Cybersecurity for Cross-Border Healthcare","2023","10.3233/SHTI230463","https://www.scopus.com/inward/record.uri?eid=2-s2.0-85164231989&doi=10.3233%2fSHTI230463&partnerID=40&md5=e70bd87060588b981e91072f7fc354d3"
"Tasia T.; Maga-Nteve C.; Tsolakis N.; Meditskos G.; Mavropoulos T.; Vrochidis S.","Tasia, Theodora (59199838700); Maga-Nteve, Christoniki (57192694536); Tsolakis, Nikos (57413752300); Meditskos, Georgios (14035720700); Mavropoulos, Thanassis (57204393013); Vrochidis, Stefanos (23052810300)","59199838700; 57192694536; 57413752300; 14035720700; 57204393013; 23052810300","Semantic Modelling for Representation and Integration of Health Data from Wearable Devices","2024","10.1007/978-3-031-63211-2_17","https://www.scopus.com/inward/record.uri?eid=2-s2.0-85197357055&doi=10.1007%2f978-3-031-63211-2_17&partnerID=40&md5=528ed1d938d6dd9ad43c5b440947f8dd"
"Zoch M.; Gierschner C.; Andreeff A.-K.; Henke E.; Sedlmayr M.; Müller G.; Tippmann J.; Hebestreit H.; Choukair D.; Hoffmann G.F.; Fritz-Kebede F.; Toepfner N.; Berner R.; Biergans S.; Verbücheln R.; Schaaf J.; Fleck J.; Wirth F.N.; Schepers J.; Prasser F.","Zoch, Michele (57224206416); Gierschner, Christian (57224206753); Andreeff, Anne-Katrin (59008892100); Henke, Elisa (57674321900); Sedlmayr, Martin (56043034300); Müller, Gabriele (57197547504); Tippmann, Jenny (57224062777); Hebestreit, Helge (57218541026); Choukair, Daniela (55549046700); Hoffmann, Georg F. (57226229787); Fritz-Kebede, Fleur (57913908400); Toepfner, Nicole (37011414200); Berner, Reinhard (58294635500); Biergans, Stephanie (46760889100); Verbücheln, Raphael (59259433000); Schaaf, Jannik (57193580502); Fleck, Julia (57949062800); Wirth, Felix Nikolaus (57219918274); Schepers, Josef (57217126828); Prasser, Fabian (55295824400)","57224206416; 57224206753; 59008892100; 57674321900; 56043034300; 57197547504; 57224062777; 57218541026; 55549046700; 57226229787; 57913908400; 37011414200; 58294635500; 46760889100; 59259433000; 57193580502; 57949062800; 57219918274; 57217126828; 55295824400","Secondary use of patient data within decentralized studies using the example of rare diseases in Germany: A data scientist's exploration of process and lessons learned","2024","10.1177/20552076241265219","https://www.scopus.com/inward/record.uri?eid=2-s2.0-85201214229&doi=10.1177%2f20552076241265219&partnerID=40&md5=7240445b9bca269d80c4ef3652e0830c"
"Gazzarata R.; Chronaki C.; Gallego A.; Gaeta E.; Fico G.; Zampognaro P.; Mercalli F.; Giuliani F.; Allocca C.; Cangioli G.","Gazzarata, Roberta (36466289400); Chronaki, Catherine (6701349152); Gallego, Alba (57212085783); Gaeta, Eugenio (23469338000); Fico, Giuseppe (16174738100); Zampognaro, Paolo (56038433500); Mercalli, Franco (6506406780); Giuliani, Francesco (56522624000); Allocca, Carlo (36241199500); Cangioli, Giorgio (56690472900)","36466289400; 6701349152; 57212085783; 23469338000; 16174738100; 56038433500; 6506406780; 56522624000; 36241199500; 56690472900","Experience from the Development of HL7 FHIR IG for Gatekeeper Project","2023","10.3233/SHTI230435","https://www.scopus.com/inward/record.uri?eid=2-s2.0-85164234250&doi=10.3233%2fSHTI230435&partnerID=40&md5=edff9e64c49f8aa72ff6f6983865fd8c"
